"No.","Time","Source","Destination","Protocol","Length","Info"
"1","0.000000000","0.0.0.0","255.255.255.255","DHCP","342","DHCP Discover - Transaction ID 0xa5daa43b"
"2","0.204113960","AzureWaveTec_40:47:91","Broadcast","ARP","42","Who has 1.1.1.1? Tell 100.96.0.2"
"3","1.229221928","AzureWaveTec_40:47:91","Broadcast","ARP","42","Who has 1.1.1.1? Tell 100.96.0.2"
"4","1.435179718","AzureWaveTec_40:47:91","Broadcast","ARP","42","Who has 8.8.8.8? Tell 100.96.0.2"
"5","1.435196577","0.0.0.0","255.255.255.255","DHCP","342","DHCP Discover - Transaction ID 0xa5daa43b"
"6","2.457563639","0.0.0.0","255.255.255.255","DHCP","318","DHCP Discover - Transaction ID 0xa900d4ac"
"7","2.776234704","0.0.0.0","255.255.255.255","DHCP","329","DHCP Discover - Transaction ID 0x74640844"
"8","3.276379589","AzureWaveTec_40:47:91","Broadcast","ARP","42","Who has 1.1.1.1? Tell 100.96.0.2"
"9","3.482095739","AzureWaveTec_40:47:91","Broadcast","ARP","42","Who has 8.8.8.8? Tell 100.96.0.2"
"10","4.300653576","AzureWaveTec_40:47:91","Broadcast","ARP","42","Who has 1.1.1.1? Tell 100.96.0.2"
"11","5.239881071","fdcc:1705:6306:16:2c3c:8cd9:35be:5cd6","2a00:1450:400c:c0c::5e","TCP","86","57286  >  80 [ACK] Seq=1 Ack=1 Win=63 Len=0 TSval=3697028624 TSecr=4156068808"
"12","5.305404896","2a00:1450:400c:c0c::5e","fdcc:1705:6306:16:2c3c:8cd9:35be:5cd6","TCP","86","[TCP ACKed unseen segment] 80  >  57286 [ACK] Seq=1 Ack=2 Win=1053 Len=0 TSval=4156079048 TSecr=3696987773"
"13","5.324732054","AzureWaveTec_40:47:91","Broadcast","ARP","42","Who has 1.1.1.1? Tell 100.96.0.2"
"14","5.529104582","AzureWaveTec_40:47:91","Broadcast","ARP","42","Who has 8.8.8.8? Tell 100.96.0.2"
"15","6.277780509","fe80::84c6:4b18:4f3:b8da","ff02::16","ICMPv6","90","Multicast Listener Report Message v2"
"16","6.350683885","0.0.0.0","255.255.255.255","DHCP","342","DHCP Discover - Transaction ID 0x230c0b53"
"17","6.553895514","0.0.0.0","255.255.255.255","DHCP","326","DHCP Discover - Transaction ID 0xdacc3dce"
"18","6.903843705","fe80::84c6:4b18:4f3:b8da","ff02::16","ICMPv6","90","Multicast Listener Report Message v2"
"19","7.172008690","2603:1026:c03:7074::2","fdcc:1705:6306:16:2c3c:8cd9:35be:5cd6","TLSv1.2","127","Application Data"
"20","7.172063231","fdcc:1705:6306:16:2c3c:8cd9:35be:5cd6","2603:1026:c03:7074::2","TCP","86","35718  >  443 [ACK] Seq=1 Ack=42 Win=57 Len=0 TSval=3711465769 TSecr=453739926"
"21","7.276822457","fdcc:1705:6306:16:2c3c:8cd9:35be:5cd6","fdcc:1705:6306:16::1","DNS","93","Standard query 0x2b7f AAAA ipv4only.arpa"
"22","7.276872054","fdcc:1705:6306:16:2c3c:8cd9:35be:5cd6","fdcc:1705:6306:16::1","DNS","91","Standard query 0x8d96 AAAA example.org"
"23","7.277878691","fdcc:1705:6306:16:2c3c:8cd9:35be:5cd6","2600:1901:0:38d7::","HTTP","408","GET /success.txt?ipv6 HTTP/1.1 "
"24","7.278983401","fdcc:1705:6306:16:2c3c:8cd9:35be:5cd6","2600:1901:0:38d7::","HTTP","391","GET /canonical.html HTTP/1.1 "
"25","7.283458854","fdcc:1705:6306:16::1","fdcc:1705:6306:16:2c3c:8cd9:35be:5cd6","DNS","176","Standard query response 0x2b7f AAAA ipv4only.arpa SOA sns.dns.icann.org"
"26","7.283470332","fdcc:1705:6306:16::1","fdcc:1705:6306:16:2c3c:8cd9:35be:5cd6","DNS","203","Standard query response 0x8d96 AAAA example.org AAAA 2600:1408:ec00:36::1736:7f2f AAAA 2600:1406:5e00:6::17ce:bc29 AAAA 2600:1408:ec00:36::1736:7f2e AAAA 2600:1406:5e00:6::17ce:bc3c"
"27","7.331814359","2600:1901:0:38d7::","fdcc:1705:6306:16:2c3c:8cd9:35be:5cd6","HTTP","302","HTTP/1.1 200 OK  (text/plain)"
"28","7.331815706","2600:1901:0:38d7::","fdcc:1705:6306:16:2c3c:8cd9:35be:5cd6","HTTP","384","HTTP/1.1 200 OK  (text/html)"
"29","7.331864470","fdcc:1705:6306:16:2c3c:8cd9:35be:5cd6","2600:1901:0:38d7::","TCP","86","40332  >  80 [ACK] Seq=323 Ack=217 Win=64 Len=0 TSval=2361011973 TSecr=1672114681"
"30","7.331882453","fdcc:1705:6306:16:2c3c:8cd9:35be:5cd6","2600:1901:0:38d7::","TCP","86","60754  >  80 [ACK] Seq=306 Ack=299 Win=64 Len=0 TSval=2361011973 TSecr=567773680"
"31","7.333516682","fdcc:1705:6306:16:2c3c:8cd9:35be:5cd6","fdcc:1705:6306:16::1","DNS","93","Standard query 0xbfac AAAA ipv4only.arpa"
"32","7.334335471","fdcc:1705:6306:16:2c3c:8cd9:35be:5cd6","2600:1901:0:38d7::","HTTP","408","GET /success.txt?ipv6 HTTP/1.1 "
"33","7.336109429","fdcc:1705:6306:16::1","fdcc:1705:6306:16:2c3c:8cd9:35be:5cd6","DNS","176","Standard query response 0xbfac AAAA ipv4only.arpa SOA sns.dns.icann.org"
"34","7.387939081","2600:1901:0:38d7::","fdcc:1705:6306:16:2c3c:8cd9:35be:5cd6","HTTP","302","HTTP/1.1 200 OK  (text/plain)"
"35","7.428852540","fdcc:1705:6306:16:2c3c:8cd9:35be:5cd6","2600:1901:0:38d7::","TCP","86","40332  >  80 [ACK] Seq=645 Ack=433 Win=64 Len=0 TSval=2361012070 TSecr=1672114739"
"36","7.475851185","fdcc:1705:6306:16:2c3c:8cd9:35be:5cd6","2a06:98c1:3107::6812:2715","TLSv1.2","118","Application Data"
"37","7.517290575","2a06:98c1:3107::6812:2715","fdcc:1705:6306:16:2c3c:8cd9:35be:5cd6","TCP","86","443  >  50788 [ACK] Seq=1 Ack=33 Win=16 Len=0 TSval=1100164689 TSecr=413580752"
"38","7.556891990","2a06:98c1:3107::6812:2715","fdcc:1705:6306:16:2c3c:8cd9:35be:5cd6","TLSv1.2","114","Application Data"
"39","7.576952299","AzureWaveTec_40:47:91","Broadcast","ARP","42","Who has 8.8.8.8? Tell 100.96.0.2"
"40","7.577746579","AzureWaveTec_40:47:91","Broadcast","ARP","42","Who has 1.1.1.1? Tell 100.96.0.2"
"41","7.598794826","fdcc:1705:6306:16:2c3c:8cd9:35be:5cd6","2a06:98c1:3107::6812:2715","TCP","86","50788  >  443 [ACK] Seq=33 Ack=29 Win=63 Len=0 TSval=413580875 TSecr=1100164725"
"42","8.396886609","0.0.0.0","255.255.255.255","DHCP","347","DHCP Discover - Transaction ID 0x669d4875"
"43","8.602382359","0.0.0.0","255.255.255.255","DHCP","342","DHCP Discover - Transaction ID 0xa5daa43b"
"44","8.602397103","AzureWaveTec_40:47:91","Broadcast","ARP","42","Who has 1.1.1.1? Tell 100.96.0.2"
"45","9.420379440","AzureWaveTec_40:47:91","Broadcast","ARP","42","Who has 8.8.8.8? Tell 100.96.0.2"
"46","9.627631548","2a06:98c1:3107::6812:2715","fdcc:1705:6306:16:2c3c:8cd9:35be:5cd6","TLSv1.2","110","Application Data"
"47","9.627670031","fdcc:1705:6306:16:2c3c:8cd9:35be:5cd6","2a06:98c1:3107::6812:2715","TCP","86","50788  >  443 [ACK] Seq=33 Ack=53 Win=63 Len=0 TSval=413582903 TSecr=1100166790"
"48","9.627891475","fdcc:1705:6306:16:2c3c:8cd9:35be:5cd6","2a06:98c1:3107::6812:2715","TLSv1.2","114","Application Data"
"49","9.714208217","2a06:98c1:3107::6812:2715","fdcc:1705:6306:16:2c3c:8cd9:35be:5cd6","TCP","86","443  >  50788 [ACK] Seq=53 Ack=61 Win=16 Len=0 TSval=1100166887 TSecr=413582904"
"50","10.444313234","AzureWaveTec_40:47:91","Broadcast","ARP","42","Who has 8.8.8.8? Tell 100.96.0.2"
"51","11.058803704","AzureWaveTec_40:47:91","Broadcast","ARP","42","Who has 1.1.1.1? Tell 100.96.0.2"
"52","11.468368769","AzureWaveTec_40:47:91","Broadcast","ARP","42","Who has 8.8.8.8? Tell 100.96.0.2"
"53","11.930645317","fdcc:1705:6306:16:2c3c:8cd9:35be:5cd6","fdcc:1705:6306:16::1","DNS","106","Standard query 0x2ff1 AAAA mozilla.cloudflare-dns.com"
"54","11.934382587","fdcc:1705:6306:16::1","fdcc:1705:6306:16:2c3c:8cd9:35be:5cd6","DNS","162","Standard query response 0x2ff1 AAAA mozilla.cloudflare-dns.com AAAA 2a06:98c1:52::4 AAAA 2803:f800:53::4"
"55","11.939471176","fdcc:1705:6306:16:2c3c:8cd9:35be:5cd6","2a06:98c1:52::4","QUIC","1294","Initial, DCID=df316185c23d3a20fcba48e245, SCID=ab2150, PKN: 0, CRYPTO, CRYPTO"
"56","11.939530753","fdcc:1705:6306:16:2c3c:8cd9:35be:5cd6","2a06:98c1:52::4","QUIC","1294","Initial, DCID=df316185c23d3a20fcba48e245, SCID=ab2150, PKN: 1, CRYPTO"
"57","11.939579299","fdcc:1705:6306:16:2c3c:8cd9:35be:5cd6","2a06:98c1:52::4","QUIC","1294","0-RTT, DCID=df316185c23d3a20fcba48e245, SCID=ab2150"
"58","12.003826446","2a06:98c1:52::4","fdcc:1705:6306:16:2c3c:8cd9:35be:5cd6","QUIC","1262","Initial, DCID=ab2150, SCID=011b2d4e8092ff2db81b634e2592e5066d41ddd2, PKN: 0, ACK"
"59","12.003827062","2a06:98c1:52::4","fdcc:1705:6306:16:2c3c:8cd9:35be:5cd6","QUIC","1262","Initial, DCID=ab2150, SCID=011b2d4e8092ff2db81b634e2592e5066d41ddd2, PKN: 1, ACK"
"60","12.006987659","2a06:98c1:52::4","fdcc:1705:6306:16:2c3c:8cd9:35be:5cd6","QUIC","1262","Initial, DCID=ab2150, SCID=011b2d4e8092ff2db81b634e2592e5066d41ddd2, PKN: 2, ACK"
"61","12.009723794","2a06:98c1:52::4","fdcc:1705:6306:16:2c3c:8cd9:35be:5cd6","QUIC","1262","Initial, DCID=ab2150, SCID=011b2d4e8092ff2db81b634e2592e5066d41ddd2, PKN: 3, CRYPTO"
"62","12.009724352","2a06:98c1:52::4","fdcc:1705:6306:16:2c3c:8cd9:35be:5cd6","QUIC","1262","Protected Payload (KP0), DCID=ab2150"
"63","12.013536532","fdcc:1705:6306:16:2c3c:8cd9:35be:5cd6","2a06:98c1:52::4","QUIC","678","Protected Payload (KP0), DCID=011b2d4e8092ff2db81b634e2592e5066d41ddd2"
"64","12.064725545","2a06:98c1:52::4","fdcc:1705:6306:16:2c3c:8cd9:35be:5cd6","QUIC","119","Protected Payload (KP0), DCID=ab2150"
"65","12.067780813","2a06:98c1:52::4","fdcc:1705:6306:16:2c3c:8cd9:35be:5cd6","QUIC","89","Protected Payload (KP0), DCID=ab2150"
"66","12.067781406","2a06:98c1:52::4","fdcc:1705:6306:16:2c3c:8cd9:35be:5cd6","QUIC","89","Protected Payload (KP0), DCID=ab2150"
"67","12.067781536","2a06:98c1:52::4","fdcc:1705:6306:16:2c3c:8cd9:35be:5cd6","QUIC","114","Protected Payload (KP0), DCID=ab2150"
"68","12.067781659","2a06:98c1:52::4","fdcc:1705:6306:16:2c3c:8cd9:35be:5cd6","QUIC","686","Protected Payload (KP0), DCID=ab2150"
"69","12.068516995","fdcc:1705:6306:16:2c3c:8cd9:35be:5cd6","2a06:98c1:52::4","QUIC","107","Protected Payload (KP0), DCID=011b2d4e8092ff2db81b634e2592e5066d41ddd2"
"70","12.071138019","2a06:98c1:52::4","fdcc:1705:6306:16:2c3c:8cd9:35be:5cd6","QUIC","650","Protected Payload (KP0), DCID=ab2150"
"71","12.076738654","fdcc:1705:6306:16:2c3c:8cd9:35be:5cd6","2a06:98c1:52::4","QUIC","311","Protected Payload (KP0), DCID=011b2d4e8092ff2db81b634e2592e5066d41ddd2"
"72","12.077213937","fdcc:1705:6306:16:2c3c:8cd9:35be:5cd6","2a06:98c1:52::4","QUIC","311","Protected Payload (KP0), DCID=011b2d4e8092ff2db81b634e2592e5066d41ddd2"
"73","12.077532484","fdcc:1705:6306:16:2c3c:8cd9:35be:5cd6","2a06:98c1:52::4","QUIC","311","Protected Payload (KP0), DCID=011b2d4e8092ff2db81b634e2592e5066d41ddd2"
"74","12.091456569","fdcc:1705:6306:16:2c3c:8cd9:35be:5cd6","2a06:98c1:52::4","QUIC","106","Protected Payload (KP0), DCID=011b2d4e8092ff2db81b634e2592e5066d41ddd2"
"75","12.091548457","AzureWaveTec_40:47:91","Broadcast","ARP","42","Who has 1.1.1.1? Tell 100.96.0.2"
"76","12.106459862","2a06:98c1:52::4","fdcc:1705:6306:16:2c3c:8cd9:35be:5cd6","QUIC","88","Protected Payload (KP0), DCID=ab2150"
"77","12.129379674","2a06:98c1:52::4","fdcc:1705:6306:16:2c3c:8cd9:35be:5cd6","QUIC","89","Protected Payload (KP0), DCID=ab2150"
"78","12.130518984","2a06:98c1:52::4","fdcc:1705:6306:16:2c3c:8cd9:35be:5cd6","QUIC","650","Protected Payload (KP0), DCID=ab2150"
"79","12.131639978","2a06:98c1:52::4","fdcc:1705:6306:16:2c3c:8cd9:35be:5cd6","QUIC","650","Protected Payload (KP0), DCID=ab2150"
"80","12.132135031","fdcc:1705:6306:16:2c3c:8cd9:35be:5cd6","2a06:98c1:52::4","QUIC","105","Protected Payload (KP0), DCID=011b2d4e8092ff2db81b634e2592e5066d41ddd2"
"81","12.135017854","2a06:98c1:52::4","fdcc:1705:6306:16:2c3c:8cd9:35be:5cd6","QUIC","650","Protected Payload (KP0), DCID=ab2150"
"82","12.155265178","fdcc:1705:6306:16:2c3c:8cd9:35be:5cd6","2a06:98c1:52::4","QUIC","106","Protected Payload (KP0), DCID=011b2d4e8092ff2db81b634e2592e5066d41ddd2"
"83","12.174568155","fdcc:1705:6306:16:2c3c:8cd9:35be:5cd6","2a06:98c1:52::4","QUIC","522","Protected Payload (KP0), DCID=011b2d4e8092ff2db81b634e2592e5066d41ddd2"
"84","12.175858178","fdcc:1705:6306:16:2c3c:8cd9:35be:5cd6","2001:6a8:3081:10f1::1:b","TCP","94","53354  >  443 [SYN] Seq=0 Win=64800 Len=0 MSS=1440 SACK_PERM TSval=3285562564 TSecr=0 WS=1024"
"85","12.176050711","fdcc:1705:6306:16:2c3c:8cd9:35be:5cd6","2001:6a8:3081:10f1::1:b","TCP","94","53366  >  443 [SYN] Seq=0 Win=64800 Len=0 MSS=1440 SACK_PERM TSval=3285562564 TSecr=0 WS=1024"
"86","12.176224194","fdcc:1705:6306:16:2c3c:8cd9:35be:5cd6","2001:6a8:3081:10f1::1:b","TCP","94","53368  >  443 [SYN] Seq=0 Win=64800 Len=0 MSS=1440 SACK_PERM TSval=3285562564 TSecr=0 WS=1024"
"87","12.227595207","2001:6a8:3081:10f1::1:b","fdcc:1705:6306:16:2c3c:8cd9:35be:5cd6","TCP","94","443  >  53354 [SYN, ACK] Seq=0 Ack=1 Win=64260 Len=0 MSS=1360 SACK_PERM TSval=1988788611 TSecr=3285562564 WS=128"
"88","12.227620400","2a06:98c1:52::4","fdcc:1705:6306:16:2c3c:8cd9:35be:5cd6","QUIC","89","Protected Payload (KP0), DCID=ab2150"
"89","12.227638775","fdcc:1705:6306:16:2c3c:8cd9:35be:5cd6","2001:6a8:3081:10f1::1:b","TCP","74","53354  >  443 [RST] Seq=1 Win=0 Len=0"
"90","12.229747989","2a06:98c1:52::4","fdcc:1705:6306:16:2c3c:8cd9:35be:5cd6","QUIC","650","Protected Payload (KP0), DCID=ab2150"
"91","12.230300517","fdcc:1705:6306:16:2c3c:8cd9:35be:5cd6","2a06:98c1:52::4","QUIC","105","Protected Payload (KP0), DCID=011b2d4e8092ff2db81b634e2592e5066d41ddd2"
"92","12.233143626","2001:6a8:3081:10f1::1:b","fdcc:1705:6306:16:2c3c:8cd9:35be:5cd6","TCP","94","443  >  53368 [SYN, ACK] Seq=0 Ack=1 Win=64260 Len=0 MSS=1360 SACK_PERM TSval=1988788620 TSecr=3285562564 WS=128"
"93","12.233143924","2001:6a8:3081:10f1::1:b","fdcc:1705:6306:16:2c3c:8cd9:35be:5cd6","TCP","94","443  >  53366 [SYN, ACK] Seq=0 Ack=1 Win=64260 Len=0 MSS=1360 SACK_PERM TSval=1988788619 TSecr=3285562564 WS=128"
"94","12.233150379","2a06:98c1:52::4","fdcc:1705:6306:16:2c3c:8cd9:35be:5cd6","QUIC","650","Protected Payload (KP0), DCID=ab2150"
"95","12.233185922","fdcc:1705:6306:16:2c3c:8cd9:35be:5cd6","2001:6a8:3081:10f1::1:b","TCP","74","53366  >  443 [RST] Seq=1 Win=0 Len=0"
"96","12.233206897","fdcc:1705:6306:16:2c3c:8cd9:35be:5cd6","2001:6a8:3081:10f1::1:b","TCP","74","53368  >  443 [RST] Seq=1 Win=0 Len=0"
"97","12.237664936","fdcc:1705:6306:16:2c3c:8cd9:35be:5cd6","2a06:98c1:52::4","QUIC","311","Protected Payload (KP0), DCID=011b2d4e8092ff2db81b634e2592e5066d41ddd2"
"98","12.238264127","fdcc:1705:6306:16:2c3c:8cd9:35be:5cd6","2a06:98c1:52::4","QUIC","522","Protected Payload (KP0), DCID=011b2d4e8092ff2db81b634e2592e5066d41ddd2"
"99","12.253414982","fdcc:1705:6306:16:2c3c:8cd9:35be:5cd6","2a06:98c1:52::4","QUIC","106","Protected Payload (KP0), DCID=011b2d4e8092ff2db81b634e2592e5066d41ddd2"
"100","12.290118666","2a06:98c1:52::4","fdcc:1705:6306:16:2c3c:8cd9:35be:5cd6","QUIC","89","Protected Payload (KP0), DCID=ab2150"
"101","12.292662135","2a06:98c1:52::4","fdcc:1705:6306:16:2c3c:8cd9:35be:5cd6","QUIC","650","Protected Payload (KP0), DCID=ab2150"
"102","12.295981140","2a06:98c1:52::4","fdcc:1705:6306:16:2c3c:8cd9:35be:5cd6","QUIC","650","Protected Payload (KP0), DCID=ab2150"
"103","12.295981508","2a06:98c1:52::4","fdcc:1705:6306:16:2c3c:8cd9:35be:5cd6","QUIC","650","Protected Payload (KP0), DCID=ab2150"
"104","12.296947341","fdcc:1705:6306:16:2c3c:8cd9:35be:5cd6","2a06:98c1:52::4","QUIC","106","Protected Payload (KP0), DCID=011b2d4e8092ff2db81b634e2592e5066d41ddd2"
"105","12.641526197","fdcc:1705:6306:16:2c3c:8cd9:35be:5cd6","2001:6a8:3081:10f1::1:b","TCP","94","53384  >  443 [SYN] Seq=0 Win=64800 Len=0 MSS=1440 SACK_PERM TSval=3285563029 TSecr=0 WS=1024"
"106","12.712627600","2001:6a8:3081:10f1::1:b","fdcc:1705:6306:16:2c3c:8cd9:35be:5cd6","TCP","94","443  >  53384 [SYN, ACK] Seq=0 Ack=1 Win=64260 Len=0 MSS=1360 SACK_PERM TSval=1988789100 TSecr=3285563029 WS=128"
"107","12.712684563","fdcc:1705:6306:16:2c3c:8cd9:35be:5cd6","2001:6a8:3081:10f1::1:b","TCP","86","53384  >  443 [ACK] Seq=1 Ack=1 Win=65536 Len=0 TSval=3285563100 TSecr=1988789100"
"108","12.714170880","fdcc:1705:6306:16:2c3c:8cd9:35be:5cd6","2001:6a8:3081:10f1::1:b","TLSv1.2","1990","Client Hello (SNI=moodle.uclouvain.be)"
"109","12.766234192","2001:6a8:3081:10f1::1:b","fdcc:1705:6306:16:2c3c:8cd9:35be:5cd6","TCP","98","[TCP Dup ACK 106#1] 443  >  53384 [ACK] Seq=1 Ack=1 Win=64384 Len=0 TSval=1988789156 TSecr=3285563100 SLE=1349 SRE=1905"
"110","12.766234732","2001:6a8:3081:10f1::1:b","fdcc:1705:6306:16:2c3c:8cd9:35be:5cd6","TCP","86","443  >  53384 [ACK] Seq=1 Ack=1905 Win=63232 Len=0 TSval=1988789157 TSecr=3285563102"
"111","12.767079115","2001:6a8:3081:10f1::1:b","fdcc:1705:6306:16:2c3c:8cd9:35be:5cd6","TLSv1.2","1069","[TCP Previous segment not captured] , Ignored Unknown Record"
"112","12.767079477","2001:6a8:3081:10f1::1:b","fdcc:1705:6306:16:2c3c:8cd9:35be:5cd6","TCP","1434","[TCP Out-Of-Order] 443  >  53384 [ACK] Seq=1 Ack=1905 Win=64128 Len=1348 TSval=1988789157 TSecr=3285563102"
"113","12.767079564","2001:6a8:3081:10f1::1:b","fdcc:1705:6306:16:2c3c:8cd9:35be:5cd6","TCP","1434","[TCP Out-Of-Order] 443  >  53384 [ACK] Seq=1349 Ack=1905 Win=64128 Len=1348 TSval=1988789157 TSecr=3285563102"
"114","12.767110544","fdcc:1705:6306:16:2c3c:8cd9:35be:5cd6","2001:6a8:3081:10f1::1:b","TCP","98","[TCP Dup ACK 107#1] 53384  >  443 [ACK] Seq=1905 Ack=1 Win=65536 Len=0 TSval=3285563155 TSecr=1988789157 SLE=2697 SRE=3680"
"115","12.767138692","fdcc:1705:6306:16:2c3c:8cd9:35be:5cd6","2001:6a8:3081:10f1::1:b","TCP","98","53384  >  443 [ACK] Seq=1905 Ack=1349 Win=64512 Len=0 TSval=3285563155 TSecr=1988789157 SLE=2697 SRE=3680"
"116","12.767150609","fdcc:1705:6306:16:2c3c:8cd9:35be:5cd6","2001:6a8:3081:10f1::1:b","TCP","86","53384  >  443 [ACK] Seq=1905 Ack=3680 Win=62464 Len=0 TSval=3285563155 TSecr=1988789157"
"117","12.783220849","fdcc:1705:6306:16:2c3c:8cd9:35be:5cd6","2a06:98c1:52::4","QUIC","522","Protected Payload (KP0), DCID=011b2d4e8092ff2db81b634e2592e5066d41ddd2"
"118","12.834310338","2a06:98c1:52::4","fdcc:1705:6306:16:2c3c:8cd9:35be:5cd6","QUIC","89","Protected Payload (KP0), DCID=ab2150"
"119","12.836207335","2a06:98c1:52::4","fdcc:1705:6306:16:2c3c:8cd9:35be:5cd6","QUIC","650","Protected Payload (KP0), DCID=ab2150"
"120","12.836847046","fdcc:1705:6306:16:2c3c:8cd9:35be:5cd6","2a06:98c1:52::4","QUIC","105","Protected Payload (KP0), DCID=011b2d4e8092ff2db81b634e2592e5066d41ddd2"
"121","12.838413928","2a06:98c1:52::4","fdcc:1705:6306:16:2c3c:8cd9:35be:5cd6","QUIC","650","Protected Payload (KP0), DCID=ab2150"
"122","12.839239500","fdcc:1705:6306:16:2c3c:8cd9:35be:5cd6","2a06:98c1:310a::6812:26e9","TCP","94","51378  >  80 [SYN] Seq=0 Win=64800 Len=0 MSS=1440 SACK_PERM TSval=2758717169 TSecr=0 WS=1024"
"123","12.858658562","fdcc:1705:6306:16:2c3c:8cd9:35be:5cd6","2a06:98c1:52::4","QUIC","106","Protected Payload (KP0), DCID=011b2d4e8092ff2db81b634e2592e5066d41ddd2"
"124","12.887208396","2a06:98c1:310a::6812:26e9","fdcc:1705:6306:16:2c3c:8cd9:35be:5cd6","TCP","94","80  >  51378 [SYN, ACK] Seq=0 Ack=1 Win=65535 Len=0 MSS=1360 SACK_PERM TSval=2882821135 TSecr=2758717169 WS=8192"
"125","12.887290346","fdcc:1705:6306:16:2c3c:8cd9:35be:5cd6","2a06:98c1:310a::6812:26e9","TCP","86","51378  >  80 [ACK] Seq=1 Ack=1 Win=65536 Len=0 TSval=2758717217 TSecr=2882821135"
"126","12.889963819","fdcc:1705:6306:16:2c3c:8cd9:35be:5cd6","2a06:98c1:310a::6812:26e9","OCSP","529","Request"
"127","12.939705172","2a06:98c1:310a::6812:26e9","fdcc:1705:6306:16:2c3c:8cd9:35be:5cd6","TCP","86","80  >  51378 [ACK] Seq=1 Ack=444 Win=131072 Len=0 TSval=2882821192 TSecr=2758717220"
"128","12.985505664","2a06:98c1:310a::6812:26e9","fdcc:1705:6306:16:2c3c:8cd9:35be:5cd6","OCSP","1187","Response"
"129","12.985547802","fdcc:1705:6306:16:2c3c:8cd9:35be:5cd6","2a06:98c1:310a::6812:26e9","TCP","86","51378  >  80 [ACK] Seq=444 Ack=1102 Win=64512 Len=0 TSval=2758717315 TSecr=2882821238"
"130","12.990141896","fdcc:1705:6306:16:2c3c:8cd9:35be:5cd6","2001:6a8:3081:10f1::1:b","TLSv1.2","150","Change Cipher Spec, Application Data"
"131","12.991150111","fdcc:1705:6306:16:2c3c:8cd9:35be:5cd6","2001:6a8:3081:10f1::1:b","TLSv1.2","1283","Application Data"
"132","13.037052190","2001:6a8:3081:10f1::1:b","fdcc:1705:6306:16:2c3c:8cd9:35be:5cd6","TLSv1.2","165","Application Data"
"133","13.037052523","2001:6a8:3081:10f1::1:b","fdcc:1705:6306:16:2c3c:8cd9:35be:5cd6","TLSv1.2","165","Application Data"
"134","13.037076531","fdcc:1705:6306:16:2c3c:8cd9:35be:5cd6","2001:6a8:3081:10f1::1:b","TCP","86","53384  >  443 [ACK] Seq=3166 Ack=3759 Win=62464 Len=0 TSval=3285563425 TSecr=1988789428"
"135","13.037087921","fdcc:1705:6306:16:2c3c:8cd9:35be:5cd6","2001:6a8:3081:10f1::1:b","TCP","86","53384  >  443 [ACK] Seq=3166 Ack=3838 Win=62464 Len=0 TSval=3285563425 TSecr=1988789428"
"136","13.082331427","2001:6a8:3081:10f1::1:b","fdcc:1705:6306:16:2c3c:8cd9:35be:5cd6","TCP","86","443  >  53384 [ACK] Seq=3838 Ack=3166 Win=64128 Len=0 TSval=1988789474 TSecr=3285563379"
"137","13.086566888","2001:6a8:3081:10f1::1:b","fdcc:1705:6306:16:2c3c:8cd9:35be:5cd6","TLSv1.2","795","Application Data"
"138","13.086587799","fdcc:1705:6306:16:2c3c:8cd9:35be:5cd6","2001:6a8:3081:10f1::1:b","TCP","86","53384  >  443 [ACK] Seq=3166 Ack=4547 Win=62464 Len=0 TSval=3285563474 TSecr=1988789479"
"139","13.108465833","AzureWaveTec_40:47:91","Broadcast","ARP","42","Who has 1.1.1.1? Tell 100.96.0.2"
"140","13.145359654","fdcc:1705:6306:16:2c3c:8cd9:35be:5cd6","2001:6a8:3081:10f1::1:b","TLSv1.2","2746","Application Data"
"141","13.168337997","fdcc:1705:6306:16:2c3c:8cd9:35be:5cd6","2001:6a8:3081:10f1::1:b","TCP","94","53396  >  443 [SYN] Seq=0 Win=64800 Len=0 MSS=1440 SACK_PERM TSval=3285563556 TSecr=0 WS=1024"
"142","13.189149075","2001:6a8:3081:10f1::1:b","fdcc:1705:6306:16:2c3c:8cd9:35be:5cd6","TCP","98","[TCP Dup ACK 136#1] 443  >  53384 [ACK] Seq=4547 Ack=3166 Win=64128 Len=0 TSval=1988789580 TSecr=3285563474 SLE=4514 SRE=5826"
"143","13.191220423","2001:6a8:3081:10f1::1:b","fdcc:1705:6306:16:2c3c:8cd9:35be:5cd6","TCP","86","443  >  53384 [ACK] Seq=4547 Ack=5826 Win=63232 Len=0 TSval=1988789581 TSecr=3285563533"
"144","13.222335512","2001:6a8:3081:10f1::1:b","fdcc:1705:6306:16:2c3c:8cd9:35be:5cd6","TCP","94","443  >  53396 [SYN, ACK] Seq=0 Ack=1 Win=64260 Len=0 MSS=1360 SACK_PERM TSval=1988789607 TSecr=3285563556 WS=128"
"145","13.222388475","fdcc:1705:6306:16:2c3c:8cd9:35be:5cd6","2001:6a8:3081:10f1::1:b","TCP","86","53396  >  443 [ACK] Seq=1 Ack=1 Win=65536 Len=0 TSval=3285563610 TSecr=1988789607"
"146","13.224160111","fdcc:1705:6306:16:2c3c:8cd9:35be:5cd6","2001:6a8:3081:10f1::1:b","TLSv1.3","2161","Client Hello (SNI=moodle.uclouvain.be)"
"147","13.248949731","2001:6a8:3081:10f1::1:b","fdcc:1705:6306:16:2c3c:8cd9:35be:5cd6","TLSv1.2","969","Application Data"
"148","13.248988768","fdcc:1705:6306:16:2c3c:8cd9:35be:5cd6","2001:6a8:3081:10f1::1:b","TCP","86","53384  >  443 [ACK] Seq=5826 Ack=5430 Win=62464 Len=0 TSval=3285563637 TSecr=1988789638"
"149","13.270777741","2001:6a8:3081:10f1::1:b","fdcc:1705:6306:16:2c3c:8cd9:35be:5cd6","TCP","98","[TCP Dup ACK 144#1] 443  >  53396 [ACK] Seq=1 Ack=1 Win=64384 Len=0 TSval=1988789661 TSecr=3285563610 SLE=1349 SRE=2076"
"150","13.270778270","2001:6a8:3081:10f1::1:b","fdcc:1705:6306:16:2c3c:8cd9:35be:5cd6","TCP","86","443  >  53396 [ACK] Seq=1 Ack=2076 Win=63232 Len=0 TSval=1988789662 TSecr=3285563612"
"151","13.273036595","2001:6a8:3081:10f1::1:b","fdcc:1705:6306:16:2c3c:8cd9:35be:5cd6","TLSv1.3","311","Server Hello, Change Cipher Spec, Application Data, Application Data"
"152","13.273072641","fdcc:1705:6306:16:2c3c:8cd9:35be:5cd6","2001:6a8:3081:10f1::1:b","TCP","86","53396  >  443 [ACK] Seq=2076 Ack=226 Win=65536 Len=0 TSval=3285563661 TSecr=1988789662"
"153","13.274400718","fdcc:1705:6306:16:2c3c:8cd9:35be:5cd6","2001:6a8:3081:10f1::1:b","TLSv1.3","150","Change Cipher Spec, Application Data"
"154","13.274819012","fdcc:1705:6306:16:2c3c:8cd9:35be:5cd6","2001:6a8:3081:10f1::1:b","TLSv1.3","2606","Application Data"
"155","13.318587467","2001:6a8:3081:10f1::1:b","fdcc:1705:6306:16:2c3c:8cd9:35be:5cd6","TLSv1.3","165","Application Data"
"156","13.319717466","2001:6a8:3081:10f1::1:b","fdcc:1705:6306:16:2c3c:8cd9:35be:5cd6","TCP","86","[TCP Dup ACK 155#1] 443  >  53396 [ACK] Seq=305 Ack=2140 Win=64128 Len=0 TSval=1988789711 TSecr=3285563662"
"157","13.327093610","2001:6a8:3081:10f1::1:b","fdcc:1705:6306:16:2c3c:8cd9:35be:5cd6","TCP","98","[TCP Dup ACK 155#2] 443  >  53396 [ACK] Seq=305 Ack=2140 Win=64128 Len=0 TSval=1988789719 TSecr=3285563662 SLE=3488 SRE=4660"
"158","13.327094130","2001:6a8:3081:10f1::1:b","fdcc:1705:6306:16:2c3c:8cd9:35be:5cd6","TCP","86","443  >  53396 [ACK] Seq=305 Ack=4660 Win=63232 Len=0 TSval=1988789719 TSecr=3285563663"
"159","13.358876970","fdcc:1705:6306:16:2c3c:8cd9:35be:5cd6","2001:6a8:3081:10f1::1:b","TCP","86","53396  >  443 [ACK] Seq=4660 Ack=305 Win=65536 Len=0 TSval=3285563747 TSecr=1988789708"
"160","13.433574212","2001:6a8:3081:10f1::1:b","fdcc:1705:6306:16:2c3c:8cd9:35be:5cd6","TCP","1434","443  >  53396 [ACK] Seq=305 Ack=4660 Win=64128 Len=1348 TSval=1988789824 TSecr=3285563747 [TCP PDU reassembled in 165]"
"161","13.433621212","fdcc:1705:6306:16:2c3c:8cd9:35be:5cd6","2001:6a8:3081:10f1::1:b","TCP","86","53396  >  443 [ACK] Seq=4660 Ack=1653 Win=64512 Len=0 TSval=3285563821 TSecr=1988789824"
"162","13.438042547","2001:6a8:3081:10f1::1:b","fdcc:1705:6306:16:2c3c:8cd9:35be:5cd6","TCP","1139","[TCP Previous segment not captured] 443  >  53396 [PSH, ACK] Seq=5697 Ack=4660 Win=64128 Len=1053 TSval=1988789824 TSecr=3285563747 [TCP PDU reassembled in 165]"
"163","13.438043124","2001:6a8:3081:10f1::1:b","fdcc:1705:6306:16:2c3c:8cd9:35be:5cd6","TCP","1434","[TCP Out-Of-Order] 443  >  53396 [ACK] Seq=1653 Ack=4660 Win=64128 Len=1348 TSval=1988789824 TSecr=3285563747 [TCP PDU reassembled in 165]"
"164","13.438043206","2001:6a8:3081:10f1::1:b","fdcc:1705:6306:16:2c3c:8cd9:35be:5cd6","TCP","1434","[TCP Out-Of-Order] 443  >  53396 [ACK] Seq=3001 Ack=4660 Win=64128 Len=1348 TSval=1988789824 TSecr=3285563747 [TCP PDU reassembled in 165]"
"165","13.438043291","2001:6a8:3081:10f1::1:b","fdcc:1705:6306:16:2c3c:8cd9:35be:5cd6","TCP","1434","[TCP Out-Of-Order] 443  >  53396 [ACK] Seq=4349 Ack=4660 Win=64128 Len=1348 TSval=1988789824 TSecr=3285563747"
"166","13.438082050","fdcc:1705:6306:16:2c3c:8cd9:35be:5cd6","2001:6a8:3081:10f1::1:b","TCP","98","[TCP Dup ACK 161#1] 53396  >  443 [ACK] Seq=4660 Ack=1653 Win=64512 Len=0 TSval=3285563826 TSecr=1988789824 SLE=5697 SRE=6750"
"167","13.438108990","fdcc:1705:6306:16:2c3c:8cd9:35be:5cd6","2001:6a8:3081:10f1::1:b","TCP","98","53396  >  443 [ACK] Seq=4660 Ack=3001 Win=63488 Len=0 TSval=3285563826 TSecr=1988789824 SLE=5697 SRE=6750"
"168","13.438118768","fdcc:1705:6306:16:2c3c:8cd9:35be:5cd6","2001:6a8:3081:10f1::1:b","TCP","98","53396  >  443 [ACK] Seq=4660 Ack=4349 Win=62464 Len=0 TSval=3285563826 TSecr=1988789824 SLE=5697 SRE=6750"
"169","13.438127722","fdcc:1705:6306:16:2c3c:8cd9:35be:5cd6","2001:6a8:3081:10f1::1:b","TCP","86","53396  >  443 [ACK] Seq=4660 Ack=6750 Win=60416 Len=0 TSval=3285563826 TSecr=1988789824"
"170","13.518809785","AzureWaveTec_40:47:91","Broadcast","ARP","42","Who has 8.8.8.8? Tell 100.96.0.2"
"171","13.560882767","fdcc:1705:6306:16:2c3c:8cd9:35be:5cd6","2a06:98c1:52::4","QUIC","522","Protected Payload (KP0), DCID=011b2d4e8092ff2db81b634e2592e5066d41ddd2"
"172","13.634224257","2a06:98c1:52::4","fdcc:1705:6306:16:2c3c:8cd9:35be:5cd6","QUIC","89","Protected Payload (KP0), DCID=ab2150"
"173","13.637543305","2a06:98c1:52::4","fdcc:1705:6306:16:2c3c:8cd9:35be:5cd6","QUIC","650","Protected Payload (KP0), DCID=ab2150"
"174","13.637543896","2a06:98c1:52::4","fdcc:1705:6306:16:2c3c:8cd9:35be:5cd6","QUIC","650","Protected Payload (KP0), DCID=ab2150"
"175","13.638377918","fdcc:1705:6306:16:2c3c:8cd9:35be:5cd6","2a06:98c1:52::4","QUIC","105","Protected Payload (KP0), DCID=011b2d4e8092ff2db81b634e2592e5066d41ddd2"
"176","13.642384037","fdcc:1705:6306:16:2c3c:8cd9:35be:5cd6","2a06:98c1:52::4","QUIC","522","Protected Payload (KP0), DCID=011b2d4e8092ff2db81b634e2592e5066d41ddd2"
"177","13.642635006","fdcc:1705:6306:16:2c3c:8cd9:35be:5cd6","2a06:98c1:52::4","QUIC","312","Protected Payload (KP0), DCID=011b2d4e8092ff2db81b634e2592e5066d41ddd2"
"178","13.692898509","2a06:98c1:52::4","fdcc:1705:6306:16:2c3c:8cd9:35be:5cd6","QUIC","89","Protected Payload (KP0), DCID=ab2150"
"179","13.694048917","2a06:98c1:52::4","fdcc:1705:6306:16:2c3c:8cd9:35be:5cd6","QUIC","650","Protected Payload (KP0), DCID=ab2150"
"180","13.694049272","2a06:98c1:52::4","fdcc:1705:6306:16:2c3c:8cd9:35be:5cd6","QUIC","651","Protected Payload (KP0), DCID=ab2150"
"181","13.694049354","2a06:98c1:52::4","fdcc:1705:6306:16:2c3c:8cd9:35be:5cd6","QUIC","650","Protected Payload (KP0), DCID=ab2150"
"182","13.694860354","fdcc:1705:6306:16:2c3c:8cd9:35be:5cd6","2a06:98c1:52::4","QUIC","107","Protected Payload (KP0), DCID=011b2d4e8092ff2db81b634e2592e5066d41ddd2"
"183","13.698989484","fdcc:1705:6306:16:2c3c:8cd9:35be:5cd6","2a00:1450:400c:c04::54","QUIC","1294","Initial, DCID=988dd200e19f8f22, SCID=f87a5f, PKN: 0, CRYPTO, CRYPTO"
"184","13.699040516","fdcc:1705:6306:16:2c3c:8cd9:35be:5cd6","2a00:1450:400c:c04::54","QUIC","1294","Initial, DCID=988dd200e19f8f22, SCID=f87a5f, PKN: 1, CRYPTO, CRYPTO"
"185","13.699100793","fdcc:1705:6306:16:2c3c:8cd9:35be:5cd6","2a00:1450:400c:c04::54","QUIC","1294","0-RTT, DCID=988dd200e19f8f22, SCID=f87a5f"
"186","13.742926815","fdcc:1705:6306:16:2c3c:8cd9:35be:5cd6","2a00:1450:400c:c04::54","TCP","94","55552  >  443 [SYN] Seq=0 Win=64800 Len=0 MSS=1440 SACK_PERM TSval=2706815154 TSecr=0 WS=1024"
"187","13.749449389","2a00:1450:400c:c04::54","fdcc:1705:6306:16:2c3c:8cd9:35be:5cd6","QUIC","105","Initial, DCID=f87a5f, SCID=f88dd200e19f8f22, PKN: 1, ACK"
"188","13.749449946","2a00:1450:400c:c04::54","fdcc:1705:6306:16:2c3c:8cd9:35be:5cd6","QUIC","105","Initial, DCID=f87a5f, SCID=f88dd200e19f8f22, PKN: 2, ACK"
"189","13.752316581","2a00:1450:400c:c04::54","fdcc:1705:6306:16:2c3c:8cd9:35be:5cd6","QUIC","1294","Initial, DCID=f87a5f, SCID=f88dd200e19f8f22, PKN: 3, ACK, PADDING"
"190","13.752317126","2a00:1450:400c:c04::54","fdcc:1705:6306:16:2c3c:8cd9:35be:5cd6","QUIC","1294","Initial, DCID=f87a5f, SCID=f88dd200e19f8f22, PKN: 4, ACK, PADDING"
"191","13.752317206","2a00:1450:400c:c04::54","fdcc:1705:6306:16:2c3c:8cd9:35be:5cd6","QUIC","1294","Initial, DCID=f87a5f, SCID=f88dd200e19f8f22, PKN: 5, CRYPTO, PADDING"
"192","13.752317340","2a00:1450:400c:c04::54","fdcc:1705:6306:16:2c3c:8cd9:35be:5cd6","QUIC","370","Protected Payload (KP0), DCID=f87a5f"
"193","13.752317424","2a00:1450:400c:c04::54","fdcc:1705:6306:16:2c3c:8cd9:35be:5cd6","QUIC","679","Protected Payload (KP0), DCID=f87a5f"
"194","13.756917026","fdcc:1705:6306:16:2c3c:8cd9:35be:5cd6","2a00:1450:400c:c04::54","QUIC","1294","Protected Payload (KP0), DCID=f88dd200e19f8f22"
"195","13.756978836","fdcc:1705:6306:16:2c3c:8cd9:35be:5cd6","2a00:1450:400c:c04::54","QUIC","1294","Protected Payload (KP0), DCID=f88dd200e19f8f22"
"196","13.758986935","fdcc:1705:6306:16:2c3c:8cd9:35be:5cd6","2a00:1450:400c:c04::54","QUIC","1290","Protected Payload (KP0), DCID=f88dd200e19f8f22"
"197","13.775092344","2a00:1450:400c:c04::54","fdcc:1705:6306:16:2c3c:8cd9:35be:5cd6","QUIC","90","Protected Payload (KP0), DCID=f87a5f"
"198","13.789842401","2a00:1450:400c:c04::54","fdcc:1705:6306:16:2c3c:8cd9:35be:5cd6","TCP","94","443  >  55552 [SYN, ACK] Seq=0 Ack=1 Win=65535 Len=0 MSS=1360 SACK_PERM TSval=977197679 TSecr=2706815154 WS=256"
"199","13.789899591","fdcc:1705:6306:16:2c3c:8cd9:35be:5cd6","2a00:1450:400c:c04::54","TCP","86","55552  >  443 [ACK] Seq=1 Ack=1 Win=65536 Len=0 TSval=2706815201 TSecr=977197679"
"200","13.791583757","fdcc:1705:6306:16:2c3c:8cd9:35be:5cd6","2a00:1450:400c:c04::54","TLSv1.3","2561","Client Hello (SNI=accounts.google.com)"
"201","13.792841976","fdcc:1705:6306:16:2c3c:8cd9:35be:5cd6","2a00:1450:400c:c04::54","TLSv1.3","184","Change Cipher Spec, Application Data"
"202","13.803669031","2a00:1450:400c:c04::54","fdcc:1705:6306:16:2c3c:8cd9:35be:5cd6","QUIC","185","Protected Payload (KP0), DCID=f87a5f"
"203","13.803669539","2a00:1450:400c:c04::54","fdcc:1705:6306:16:2c3c:8cd9:35be:5cd6","QUIC","92","Protected Payload (KP0), DCID=f87a5f"
"204","13.804181496","fdcc:1705:6306:16:2c3c:8cd9:35be:5cd6","2a00:1450:400c:c04::54","QUIC","93","Protected Payload (KP0), DCID=f88dd200e19f8f22"
"205","13.837725741","2a00:1450:400c:c04::54","fdcc:1705:6306:16:2c3c:8cd9:35be:5cd6","QUIC","1290","Protected Payload (KP0), DCID=f87a5f"
"206","13.837726349","2a00:1450:400c:c04::54","fdcc:1705:6306:16:2c3c:8cd9:35be:5cd6","QUIC","456","Protected Payload (KP0), DCID=f87a5f"
"207","13.837726438","2a00:1450:400c:c04::54","fdcc:1705:6306:16:2c3c:8cd9:35be:5cd6","QUIC","99","Protected Payload (KP0), DCID=f87a5f"
"208","13.837726523","2a00:1450:400c:c04::54","fdcc:1705:6306:16:2c3c:8cd9:35be:5cd6","QUIC","238","Protected Payload (KP0), DCID=f87a5f"
"209","13.838980390","fdcc:1705:6306:16:2c3c:8cd9:35be:5cd6","2a00:1450:400c:c04::54","QUIC","99","Protected Payload (KP0), DCID=f88dd200e19f8f22"
"210","13.840060509","2a00:1450:400c:c04::54","fdcc:1705:6306:16:2c3c:8cd9:35be:5cd6","TCP","98","[TCP Dup ACK 198#1] 443  >  55552 [ACK] Seq=1 Ack=1 Win=270080 Len=0 TSval=977197733 TSecr=2706815201 SLE=1349 SRE=2476"
"211","13.840061121","2a00:1450:400c:c04::54","fdcc:1705:6306:16:2c3c:8cd9:35be:5cd6","TCP","98","[TCP Dup ACK 198#2] 443  >  55552 [ACK] Seq=1 Ack=1 Win=270080 Len=0 TSval=977197733 TSecr=2706815201 SLE=1349 SRE=2574"
"212","13.840061200","2a00:1450:400c:c04::54","fdcc:1705:6306:16:2c3c:8cd9:35be:5cd6","TCP","86","443  >  55552 [ACK] Seq=1 Ack=2574 Win=267520 Len=0 TSval=977197733 TSecr=2706815202"
"213","13.842306617","2a00:1450:400c:c04::54","fdcc:1705:6306:16:2c3c:8cd9:35be:5cd6","TLSv1.3","1944","Server Hello, Change Cipher Spec, Application Data, Application Data"
"214","13.842307081","2a00:1450:400c:c04::54","fdcc:1705:6306:16:2c3c:8cd9:35be:5cd6","TLSv1.3","148","Application Data"
"215","13.842307196","2a00:1450:400c:c04::54","fdcc:1705:6306:16:2c3c:8cd9:35be:5cd6","TLSv1.3","117","Application Data"
"216","13.842347205","fdcc:1705:6306:16:2c3c:8cd9:35be:5cd6","2a00:1450:400c:c04::54","TCP","86","55552  >  443 [ACK] Seq=2574 Ack=1859 Win=64512 Len=0 TSval=2706815253 TSecr=977197734"
"217","13.842376202","fdcc:1705:6306:16:2c3c:8cd9:35be:5cd6","2a00:1450:400c:c04::54","TCP","86","55552  >  443 [ACK] Seq=2574 Ack=1921 Win=64512 Len=0 TSval=2706815253 TSecr=977197734"
"218","13.842402548","fdcc:1705:6306:16:2c3c:8cd9:35be:5cd6","2a00:1450:400c:c04::54","TCP","86","55552  >  443 [ACK] Seq=2574 Ack=1952 Win=64512 Len=0 TSval=2706815253 TSecr=977197734"
"219","13.844256485","fdcc:1705:6306:16:2c3c:8cd9:35be:5cd6","2a00:1450:400c:c04::54","TLSv1.3","170","Application Data, Application Data"
"220","13.846550816","fdcc:1705:6306:16:2c3c:8cd9:35be:5cd6","2a00:1450:400c:c04::54","TLSv1.3","117","Application Data"
"221","13.898100966","2a00:1450:400c:c04::54","fdcc:1705:6306:16:2c3c:8cd9:35be:5cd6","TCP","86","443  >  55552 [ACK] Seq=1952 Ack=2689 Win=267520 Len=0 TSval=977197791 TSecr=2706815255"
"222","13.902008180","2a00:1450:400c:c04::54","fdcc:1705:6306:16:2c3c:8cd9:35be:5cd6","QUIC","89","Protected Payload (KP0), DCID=f87a5f"
"223","14.012831989","fdcc:1705:6306:16:2c3c:8cd9:35be:5cd6","2001:6a8:3081:10f1::1:b","TLSv1.3","1113","Application Data"
"224","14.133336016","2001:6a8:3081:10f1::1:b","fdcc:1705:6306:16:2c3c:8cd9:35be:5cd6","TCP","86","443  >  53396 [ACK] Seq=6750 Ack=5687 Win=64128 Len=0 TSval=1988790514 TSecr=3285564401"
"225","14.439573362","2001:6a8:3081:10f1::1:b","fdcc:1705:6306:16:2c3c:8cd9:35be:5cd6","TLSv1.3","566","[TCP Previous segment not captured] , Continuation Data"
"226","14.439573936","2001:6a8:3081:10f1::1:b","fdcc:1705:6306:16:2c3c:8cd9:35be:5cd6","TCP","1434","[TCP Out-Of-Order] 443  >  53396 [ACK] Seq=6750 Ack=5687 Win=64128 Len=1348 TSval=1988790779 TSecr=3285564401"
"227","14.439574016","2001:6a8:3081:10f1::1:b","fdcc:1705:6306:16:2c3c:8cd9:35be:5cd6","TCP","1434","[TCP Out-Of-Order] 443  >  53396 [ACK] Seq=8098 Ack=5687 Win=64128 Len=1348 TSval=1988790779 TSecr=3285564401"
"228","14.439574103","2001:6a8:3081:10f1::1:b","fdcc:1705:6306:16:2c3c:8cd9:35be:5cd6","TCP","1434","[TCP Out-Of-Order] 443  >  53396 [ACK] Seq=9446 Ack=5687 Win=64128 Len=1348 TSval=1988790779 TSecr=3285564401"
"229","14.439574192","2001:6a8:3081:10f1::1:b","fdcc:1705:6306:16:2c3c:8cd9:35be:5cd6","TCP","1434","[TCP Out-Of-Order] 443  >  53396 [ACK] Seq=10794 Ack=5687 Win=64128 Len=1348 TSval=1988790779 TSecr=3285564401"
"230","14.439574276","2001:6a8:3081:10f1::1:b","fdcc:1705:6306:16:2c3c:8cd9:35be:5cd6","TCP","1434","[TCP Out-Of-Order] 443  >  53396 [ACK] Seq=12142 Ack=5687 Win=64128 Len=1348 TSval=1988790779 TSecr=3285564401"
"231","14.439574409","2001:6a8:3081:10f1::1:b","fdcc:1705:6306:16:2c3c:8cd9:35be:5cd6","TCP","1434","[TCP Out-Of-Order] 443  >  53396 [ACK] Seq=13490 Ack=5687 Win=64128 Len=1348 TSval=1988790779 TSecr=3285564401"
"232","14.439574493","2001:6a8:3081:10f1::1:b","fdcc:1705:6306:16:2c3c:8cd9:35be:5cd6","TCP","1434","443  >  53396 [ACK] Seq=15318 Ack=5687 Win=64128 Len=1348 TSval=1988790779 TSecr=3285564401 [TCP PDU reassembled in 256]"
"233","14.439619941","fdcc:1705:6306:16:2c3c:8cd9:35be:5cd6","2001:6a8:3081:10f1::1:b","TCP","98","[TCP Dup ACK 169#1] 53396  >  443 [ACK] Seq=5687 Ack=6750 Win=60416 Len=0 TSval=3285564827 TSecr=1988790514 SLE=14838 SRE=15318"
"234","14.439651478","fdcc:1705:6306:16:2c3c:8cd9:35be:5cd6","2001:6a8:3081:10f1::1:b","TCP","98","53396  >  443 [ACK] Seq=5687 Ack=8098 Win=59392 Len=0 TSval=3285564827 TSecr=1988790779 SLE=14838 SRE=15318"
"235","14.439661591","fdcc:1705:6306:16:2c3c:8cd9:35be:5cd6","2001:6a8:3081:10f1::1:b","TCP","98","53396  >  443 [ACK] Seq=5687 Ack=9446 Win=58368 Len=0 TSval=3285564827 TSecr=1988790779 SLE=14838 SRE=15318"
"236","14.439668754","fdcc:1705:6306:16:2c3c:8cd9:35be:5cd6","2001:6a8:3081:10f1::1:b","TCP","98","53396  >  443 [ACK] Seq=5687 Ack=10794 Win=57344 Len=0 TSval=3285564827 TSecr=1988790779 SLE=14838 SRE=15318"
"237","14.439675798","fdcc:1705:6306:16:2c3c:8cd9:35be:5cd6","2001:6a8:3081:10f1::1:b","TCP","98","53396  >  443 [ACK] Seq=5687 Ack=12142 Win=56320 Len=0 TSval=3285564827 TSecr=1988790779 SLE=14838 SRE=15318"
"238","14.439682875","fdcc:1705:6306:16:2c3c:8cd9:35be:5cd6","2001:6a8:3081:10f1::1:b","TCP","98","53396  >  443 [ACK] Seq=5687 Ack=13490 Win=55296 Len=0 TSval=3285564827 TSecr=1988790779 SLE=14838 SRE=15318"
"239","14.439691529","fdcc:1705:6306:16:2c3c:8cd9:35be:5cd6","2001:6a8:3081:10f1::1:b","TCP","86","53396  >  443 [ACK] Seq=5687 Ack=15318 Win=54272 Len=0 TSval=3285564827 TSecr=1988790779"
"240","14.439699206","fdcc:1705:6306:16:2c3c:8cd9:35be:5cd6","2001:6a8:3081:10f1::1:b","TCP","86","53396  >  443 [ACK] Seq=5687 Ack=16666 Win=53248 Len=0 TSval=3285564827 TSecr=1988790779"
"241","14.439712616","2001:6a8:3081:10f1::1:b","fdcc:1705:6306:16:2c3c:8cd9:35be:5cd6","TCP","1434","443  >  53396 [ACK] Seq=16666 Ack=5687 Win=64128 Len=1348 TSval=1988790779 TSecr=3285564401 [TCP PDU reassembled in 256]"
"242","14.439712788","2001:6a8:3081:10f1::1:b","fdcc:1705:6306:16:2c3c:8cd9:35be:5cd6","TCP","1434","443  >  53396 [ACK] Seq=18014 Ack=5687 Win=64128 Len=1348 TSval=1988790779 TSecr=3285564401 [TCP PDU reassembled in 256]"
"243","14.439721566","fdcc:1705:6306:16:2c3c:8cd9:35be:5cd6","2001:6a8:3081:10f1::1:b","TCP","86","53396  >  443 [ACK] Seq=5687 Ack=18014 Win=52224 Len=0 TSval=3285564827 TSecr=1988790779"
"244","14.439729423","fdcc:1705:6306:16:2c3c:8cd9:35be:5cd6","2001:6a8:3081:10f1::1:b","TCP","86","53396  >  443 [ACK] Seq=5687 Ack=19362 Win=51200 Len=0 TSval=3285564827 TSecr=1988790779"
"245","14.482684605","2001:6a8:3081:10f1::1:b","fdcc:1705:6306:16:2c3c:8cd9:35be:5cd6","TCP","1434","443  >  53396 [ACK] Seq=19362 Ack=5687 Win=64128 Len=1348 TSval=1988790872 TSecr=3285564827 [TCP PDU reassembled in 256]"
"246","14.482685165","2001:6a8:3081:10f1::1:b","fdcc:1705:6306:16:2c3c:8cd9:35be:5cd6","TCP","1434","443  >  53396 [ACK] Seq=20710 Ack=5687 Win=64128 Len=1348 TSval=1988790872 TSecr=3285564827 [TCP PDU reassembled in 256]"
"247","14.482727319","fdcc:1705:6306:16:2c3c:8cd9:35be:5cd6","2001:6a8:3081:10f1::1:b","TCP","86","53396  >  443 [ACK] Seq=5687 Ack=20710 Win=50176 Len=0 TSval=3285564870 TSecr=1988790872"
"248","14.482753689","fdcc:1705:6306:16:2c3c:8cd9:35be:5cd6","2001:6a8:3081:10f1::1:b","TCP","86","53396  >  443 [ACK] Seq=5687 Ack=22058 Win=49152 Len=0 TSval=3285564870 TSecr=1988790872"
