"No.","Time","Source","Destination","Protocol","Length","Info"
"1","0.000000000","CloudNetwork_e2:9d:7d","Broadcast","XID","20","Basic Format; Type 1 LLC (Class I LLC); Window Size 0"
"2","0.000023980","0.0.0.0","255.255.255.255","DHCP","332","DHCP Discover - Transaction ID 0x92a7f2ff"
"3","0.102822885","2a0d:3344:18fa:4916:f109:b90c:1660:710d","2a00:1450:400c:c06::5e","TCP","86","40082  >  80 [FIN, ACK] Seq=1 Ack=1 Win=64 Len=0 TSval=2702374625 TSecr=800585336"
"4","0.142628385","2a00:1450:400c:c06::5e","2a0d:3344:18fa:4916:f109:b90c:1660:710d","TCP","86","80  >  40082 [FIN, ACK] Seq=1 Ack=2 Win=1055 Len=0 TSval=800590434 TSecr=2702374625"
"5","0.142673863","2a0d:3344:18fa:4916:f109:b90c:1660:710d","2a00:1450:400c:c06::5e","TCP","86","40082  >  80 [ACK] Seq=2 Ack=2 Win=64 Len=0 TSval=2702374664 TSecr=800590434"
"6","0.406999153","AzureWaveTec_40:47:91","Broadcast","ARP","42","Who has 8.8.8.8? Tell 100.96.0.2"
"7","1.021157513","0.0.0.0","255.255.255.255","DHCP","342","DHCP Discover - Transaction ID 0xa5daa436"
"8","1.430635311","AzureWaveTec_40:47:91","Broadcast","ARP","42","Who has 8.8.8.8? Tell 100.96.0.2"
"9","1.939033560","AzureWaveTec_40:47:91","Broadcast","ARP","42","Who has 1.1.1.1? Tell 100.96.0.2"
"10","2.250685895","0.0.0.0","255.255.255.255","DHCP","332","DHCP Discover - Transaction ID 0xec03fa9c"
"11","2.468723554","AzureWaveTec_40:47:91","Broadcast","ARP","42","Who has 8.8.8.8? Tell 100.96.0.2"
"12","2.963715379","AzureWaveTec_40:47:91","Broadcast","ARP","42","Who has 1.1.1.1? Tell 100.96.0.2"
"13","3.392419405","2a06:98c1:3108::ac40:94eb","2a0d:3344:18fa:4916:f109:b90c:1660:710d","TLSv1.2","110","Application Data"
"14","3.392466365","2a0d:3344:18fa:4916:f109:b90c:1660:710d","2a06:98c1:3108::ac40:94eb","TCP","86","52474  >  443 [ACK] Seq=1 Ack=25 Win=63 Len=0 TSval=1477330377 TSecr=2285804539"
"15","3.392712850","2a0d:3344:18fa:4916:f109:b90c:1660:710d","2a06:98c1:3108::ac40:94eb","TLSv1.2","114","Application Data"
"16","3.478900902","2a06:98c1:3108::ac40:94eb","2a0d:3344:18fa:4916:f109:b90c:1660:710d","TCP","86","443  >  52474 [ACK] Seq=25 Ack=29 Win=19 Len=0 TSval=2285804752 TSecr=1477330377"
"17","3.684346953","169.254.31.108","169.254.255.255","NBNS","92","Name query NB WPAD<00>"
"18","3.685878493","169.254.31.108","169.254.255.255","NBNS","92","Name query NB WPAD<00>"
"19","3.889864816","AzureWaveTec_40:47:91","Broadcast","ARP","42","Who has 1.1.1.1? Tell 100.96.0.2"
"20","3.890117295","AzureWaveTec_40:47:91","Broadcast","ARP","42","Who has 8.8.8.8? Tell 100.96.0.2"
"21","4.093094170","0.0.0.0","255.255.255.255","DHCP","342","DHCP Discover - Transaction ID 0xf1d7ae96"
"22","4.506665322","169.254.31.108","169.254.255.255","NBNS","92","Name query NB WPAD<00>"
"23","4.506665812","169.254.31.108","169.254.255.255","NBNS","92","Name query NB WPAD<00>"
"24","4.913574224","0.0.0.0","255.255.255.255","DHCP","326","DHCP Discover - Transaction ID 0x4ada3de0"
"25","4.913600017","AzureWaveTec_40:47:91","Broadcast","ARP","42","Who has 8.8.8.8? Tell 100.96.0.2"
"26","5.322466937","169.254.31.108","169.254.255.255","NBNS","92","Name query NB WPAD<00>"
"27","5.322467441","169.254.31.108","169.254.255.255","NBNS","92","Name query NB WPAD<00>"
"28","5.375981430","2a0d:3344:18fa:4916:f109:b90c:1660:710d","2a00:1450:400c:c06::5e","TCP","86","40068  >  80 [ACK] Seq=1 Ack=1 Win=60 Len=0 TSval=2702379898 TSecr=4093642193"
"29","5.427665322","2a00:1450:400c:c06::5e","2a0d:3344:18fa:4916:f109:b90c:1660:710d","TCP","86","[TCP ACKed unseen segment] 80  >  40068 [ACK] Seq=1 Ack=2 Win=1050 Len=0 TSval=4093652260 TSecr=2702369883"
"30","5.756307190","0.0.0.0","255.255.255.255","DHCP","329","DHCP Discover - Transaction ID 0x927deb82"
"31","5.937626709","AzureWaveTec_40:47:91","Broadcast","ARP","42","Who has 8.8.8.8? Tell 100.96.0.2"
"32","6.551831772","0.0.0.0","255.255.255.255","DHCP","332","DHCP Discover - Transaction ID 0x2289ccd8"
"33","6.960654898","0.0.0.0","255.255.255.255","DHCP","342","DHCP Discover - Transaction ID 0x8cb9188d"
"34","7.166764849","AzureWaveTec_40:47:91","Broadcast","ARP","42","Who has 8.8.8.8? Tell 100.96.0.2"
"35","7.985492478","0.0.0.0","255.255.255.255","DHCP","342","DHCP Discover - Transaction ID 0xa7daaccc"
"36","8.190866072","AzureWaveTec_40:47:91","Broadcast","ARP","42","Who has 8.8.8.8? Tell 100.96.0.2"
"37","8.319978842","2a0d:3344:18fa:4916:f109:b90c:1660:710d","2600:1901:0:38d7::","TCP","86","57780  >  80 [ACK] Seq=1 Ack=1 Win=64 Len=0 TSval=4279168946 TSecr=1863546508"
"38","8.320029373","2a0d:3344:18fa:4916:f109:b90c:1660:710d","2600:1901:0:38d7::","TCP","86","57764  >  80 [ACK] Seq=1 Ack=1 Win=64 Len=0 TSval=4279168946 TSecr=2804062145"
"39","8.367144766","2600:1901:0:38d7::","2a0d:3344:18fa:4916:f109:b90c:1660:710d","TCP","86","[TCP ACKed unseen segment] 80  >  57780 [ACK] Seq=1 Ack=2 Win=1053 Len=0 TSval=1863556751 TSecr=4279128193"
"40","8.370009649","2600:1901:0:38d7::","2a0d:3344:18fa:4916:f109:b90c:1660:710d","TCP","86","[TCP ACKed unseen segment] 80  >  57764 [ACK] Seq=1 Ack=2 Win=1054 Len=0 TSval=2804072375 TSecr=4279128093"
"41","9.215903658","AzureWaveTec_40:47:91","Broadcast","ARP","42","Who has 8.8.8.8? Tell 100.96.0.2"
"42","9.343811148","2a0d:3344:18fa:4916:f109:b90c:1660:710d","2a00:1450:400c:c06::5e","TCP","86","40058  >  80 [ACK] Seq=1 Ack=1 Win=59 Len=0 TSval=2702383866 TSecr=3122407614"
"43","9.391187338","2a00:1450:400c:c06::5e","2a0d:3344:18fa:4916:f109:b90c:1660:710d","TCP","86","[TCP ACKed unseen segment] 80  >  40058 [ACK] Seq=1 Ack=2 Win=1050 Len=0 TSval=3122417896 TSecr=2702373631"
"44","10.236997851","AzureWaveTec_40:47:91","Broadcast","ARP","42","Who has 1.1.1.1? Tell 100.96.0.2"
"45","10.852134881","0.0.0.0","255.255.255.255","DHCP","332","DHCP Discover - Transaction ID 0x2a2ef2d0"
"46","11.260918198","AzureWaveTec_40:47:91","Broadcast","ARP","42","Who has 1.1.1.1? Tell 100.96.0.2"
"47","11.261349774","169.254.134.246","169.254.255.255","UDP","86","57621  >  57621 Len=44"
"48","11.671697273","0.0.0.0","255.255.255.255","DHCP","347","DHCP Discover - Transaction ID 0xa77ecfa5"
"49","11.877639039","0.0.0.0","255.255.255.255","DHCP","331","DHCP Discover - Transaction ID 0x838b5873"
"50","12.080669038","AzureWaveTec_40:47:91","Broadcast","ARP","42","Who has 8.8.8.8? Tell 100.96.0.2"
"51","12.285062288","AzureWaveTec_40:47:91","Broadcast","ARP","42","Who has 1.1.1.1? Tell 100.96.0.2"
"52","13.104359086","AzureWaveTec_40:47:91","Broadcast","ARP","42","Who has 8.8.8.8? Tell 100.96.0.2"
"53","14.130333381","AzureWaveTec_40:47:91","Broadcast","ARP","42","Who has 8.8.8.8? Tell 100.96.0.2"
"54","14.130333893","AzureWaveTec_40:47:91","Broadcast","ARP","42","Who has 1.1.1.1? Tell 100.96.0.2"
"55","14.541689989","0.0.0.0","255.255.255.255","DHCP","332","DHCP Discover - Transaction ID 0x47ae6ec7"
"56","14.541691560","fe80::9683:c4ff:fe22:da08","2a0d:3344:18fa:4916:f109:b90c:1660:710d","ICMPv6","86","Neighbor Solicitation for 2a0d:3344:18fa:4916:f109:b90c:1660:710d from 94:83:c4:22:da:08"
"57","14.541736823","2a0d:3344:18fa:4916:f109:b90c:1660:710d","fe80::9683:c4ff:fe22:da08","ICMPv6","78","Neighbor Advertisement 2a0d:3344:18fa:4916:f109:b90c:1660:710d (sol)"
"58","15.153743187","AzureWaveTec_40:47:91","Broadcast","ARP","42","Who has 1.1.1.1? Tell 100.96.0.2"
"59","15.357576821","0.0.0.0","255.255.255.255","DHCP","342","DHCP Discover - Transaction ID 0x8cb9188d"
"60","15.487979402","2a0d:3344:18fa:4916:f109:b90c:1660:710d","2a00:1450:400c:c06::5e","TCP","86","[TCP Dup ACK 28#1] 40068  >  80 [ACK] Seq=1 Ack=1 Win=60 Len=0 TSval=2702390010 TSecr=4093652260"
"61","15.530422907","2a00:1450:400c:c06::5e","2a0d:3344:18fa:4916:f109:b90c:1660:710d","TCP","86","[TCP Dup ACK 29#1] 80  >  40068 [ACK] Seq=1 Ack=2 Win=1050 Len=0 TSval=4093662365 TSecr=2702369883"
"62","16.177088977","AzureWaveTec_40:47:91","Broadcast","ARP","42","Who has 1.1.1.1? Tell 100.96.0.2"
"63","16.586852088","0.0.0.0","255.255.255.255","DHCP","342","DHCP Discover - Transaction ID 0xa7daaccc"
"64","17.410003793","AzureWaveTec_40:47:91","Broadcast","ARP","42","Who has 1.1.1.1? Tell 100.96.0.2"
"65","17.610313412","AzureWaveTec_40:47:91","Broadcast","ARP","42","Who has 8.8.8.8? Tell 100.96.0.2"
"66","18.430473661","AzureWaveTec_40:47:91","Broadcast","ARP","42","Who has 1.1.1.1? Tell 100.96.0.2"
"67","18.559905727","2a0d:3344:18fa:4916:f109:b90c:1660:710d","2600:1901:0:38d7::","TCP","86","[TCP Dup ACK 37#1] 57780  >  80 [ACK] Seq=1 Ack=1 Win=64 Len=0 TSval=4279179186 TSecr=1863556751"
"68","18.559939571","2a0d:3344:18fa:4916:f109:b90c:1660:710d","2600:1901:0:38d7::","TCP","86","[TCP Dup ACK 38#1] 57764  >  80 [ACK] Seq=1 Ack=1 Win=64 Len=0 TSval=4279179186 TSecr=2804072375"
"69","18.603566970","2600:1901:0:38d7::","2a0d:3344:18fa:4916:f109:b90c:1660:710d","TCP","86","[TCP Dup ACK 39#1] 80  >  57780 [ACK] Seq=1 Ack=2 Win=1053 Len=0 TSval=1863566987 TSecr=4279128193"
"70","18.608830967","2600:1901:0:38d7::","2a0d:3344:18fa:4916:f109:b90c:1660:710d","TCP","86","[TCP Dup ACK 40#1] 80  >  57764 [ACK] Seq=1 Ack=2 Win=1054 Len=0 TSval=2804082613 TSecr=4279128093"
"71","18.634550287","AzureWaveTec_40:47:91","Broadcast","ARP","42","Who has 8.8.8.8? Tell 100.96.0.2"
"72","19.453801345","AzureWaveTec_40:47:91","Broadcast","ARP","42","Who has 1.1.1.1? Tell 100.96.0.2"
"73","19.583994083","2a0d:3344:18fa:4916:f109:b90c:1660:710d","2a00:1450:400c:c06::5e","TCP","86","[TCP Dup ACK 42#1] 40058  >  80 [ACK] Seq=1 Ack=1 Win=59 Len=0 TSval=2702394106 TSecr=3122417896"
"74","19.641862823","2a00:1450:400c:c06::5e","2a0d:3344:18fa:4916:f109:b90c:1660:710d","TCP","86","[TCP Dup ACK 43#1] 80  >  40058 [ACK] Seq=1 Ack=2 Win=1050 Len=0 TSval=3122428146 TSecr=2702373631"
"75","19.864809369","0.0.0.0","255.255.255.255","DHCP","342","DHCP Discover - Transaction ID 0x7a5023f1"
"76","20.153096195","2a0d:3344:18fa:4916:f109:b90c:1660:710d","2a00:1450:400c:c06::67","UDP","1294","41599  >  443 Len=1232"
"77","20.153136019","2a0d:3344:18fa:4916:f109:b90c:1660:710d","2a00:1450:400c:c06::67","UDP","1204","41599  >  443 Len=1142"
"78","20.220748600","2a00:1450:400c:c06::67","2a0d:3344:18fa:4916:f109:b90c:1660:710d","UDP","95","443  >  41599 Len=33"
"79","20.221093926","2a0d:3344:18fa:4916:f109:b90c:1660:710d","2a00:1450:400c:c06::67","UDP","95","41599  >  443 Len=33"
"80","20.274095113","2a00:1450:400c:c06::67","2a0d:3344:18fa:4916:f109:b90c:1660:710d","UDP","1290","443  >  41599 Len=1228"
"81","20.274095934","2a00:1450:400c:c06::67","2a0d:3344:18fa:4916:f109:b90c:1660:710d","UDP","298","443  >  41599 Len=236"
"82","20.274845143","2a0d:3344:18fa:4916:f109:b90c:1660:710d","2a00:1450:400c:c06::67","UDP","100","41599  >  443 Len=38"
"83","20.303016712","2a0d:3344:18fa:4916:f109:b90c:1660:710d","2a06:98c1:52::4","UDP","524","46946  >  443 Len=462"
"84","20.322001704","2a0d:3344:18fa:4916:f109:b90c:1660:710d","2a00:1450:400c:c06::67","UDP","1294","41599  >  443 Len=1232"
"85","20.322060284","2a0d:3344:18fa:4916:f109:b90c:1660:710d","2a00:1450:400c:c06::67","UDP","1205","41599  >  443 Len=1143"
"86","20.329224141","2a00:1450:400c:c06::67","2a0d:3344:18fa:4916:f109:b90c:1660:710d","UDP","91","443  >  41599 Len=29"
"87","20.351890092","2a06:98c1:52::4","2a0d:3344:18fa:4916:f109:b90c:1660:710d","UDP","89","443  >  46946 Len=27"
"88","20.353023746","2a06:98c1:52::4","2a0d:3344:18fa:4916:f109:b90c:1660:710d","UDP","651","443  >  46946 Len=589"
"89","20.353503056","2a0d:3344:18fa:4916:f109:b90c:1660:710d","2a06:98c1:52::4","UDP","106","46946  >  443 Len=44"
"90","20.356391151","2a06:98c1:52::4","2a0d:3344:18fa:4916:f109:b90c:1660:710d","UDP","651","443  >  46946 Len=589"
"91","20.362470803","2a0d:3344:18fa:4916:f109:b90c:1660:710d","2a06:98c1:52::4","UDP","312","46946  >  443 Len=250"
"92","20.362894439","2a0d:3344:18fa:4916:f109:b90c:1660:710d","2a06:98c1:52::4","UDP","524","46946  >  443 Len=462"
"93","20.376701613","2a0d:3344:18fa:4916:f109:b90c:1660:710d","2a06:98c1:52::4","UDP","107","46946  >  443 Len=45"
"94","20.380760207","2a00:1450:400c:c06::67","2a0d:3344:18fa:4916:f109:b90c:1660:710d","UDP","95","443  >  41599 Len=33"
"95","20.381105014","2a0d:3344:18fa:4916:f109:b90c:1660:710d","2a00:1450:400c:c06::67","UDP","95","41599  >  443 Len=33"
"96","20.399712431","2a00:1450:400c:c06::67","2a0d:3344:18fa:4916:f109:b90c:1660:710d","UDP","91","443  >  41599 Len=29"
"97","20.399712931","2a00:1450:400c:c06::67","2a0d:3344:18fa:4916:f109:b90c:1660:710d","UDP","282","443  >  41599 Len=220"
"98","20.400156335","2a0d:3344:18fa:4916:f109:b90c:1660:710d","2a00:1450:400c:c06::67","UDP","95","41599  >  443 Len=33"
"99","20.411565709","2a06:98c1:52::4","2a0d:3344:18fa:4916:f109:b90c:1660:710d","UDP","89","443  >  46946 Len=27"
"100","20.414841442","2a06:98c1:52::4","2a0d:3344:18fa:4916:f109:b90c:1660:710d","UDP","651","443  >  46946 Len=589"
"101","20.414841858","2a06:98c1:52::4","2a0d:3344:18fa:4916:f109:b90c:1660:710d","UDP","651","443  >  46946 Len=589"
"102","20.415521282","2a0d:3344:18fa:4916:f109:b90c:1660:710d","2a06:98c1:52::4","UDP","106","46946  >  443 Len=44"
"103","20.416160293","2a06:98c1:52::4","2a0d:3344:18fa:4916:f109:b90c:1660:710d","UDP","651","443  >  46946 Len=589"
"104","20.420014140","2a0d:3344:18fa:4916:f109:b90c:1660:710d","2a00:1450:400c:c0b::71","QUIC","1294","Initial, DCID=891580fed5667f63a890f30dc1e3, SCID=86ac02, PKN: 0, CRYPTO, CRYPTO"
"105","20.420090939","2a0d:3344:18fa:4916:f109:b90c:1660:710d","2a00:1450:400c:c0b::71","QUIC","1294","Initial, DCID=891580fed5667f63a890f30dc1e3, SCID=86ac02, PKN: 1, CRYPTO"
"106","20.436482141","2a0d:3344:18fa:4916:f109:b90c:1660:710d","2a06:98c1:52::4","UDP","107","46946  >  443 Len=45"
"107","20.445111017","2a00:1450:400c:c06::67","2a0d:3344:18fa:4916:f109:b90c:1660:710d","UDP","1290","443  >  41599 Len=1228"
"108","20.445111613","2a00:1450:400c:c06::67","2a0d:3344:18fa:4916:f109:b90c:1660:710d","UDP","128","443  >  41599 Len=66"
"109","20.445875039","2a0d:3344:18fa:4916:f109:b90c:1660:710d","2a00:1450:400c:c06::67","UDP","100","41599  >  443 Len=38"
"110","20.446877264","2a00:1450:400c:c06::67","2a0d:3344:18fa:4916:f109:b90c:1660:710d","UDP","91","443  >  41599 Len=29"
"111","20.446877676","2a00:1450:400c:c06::67","2a0d:3344:18fa:4916:f109:b90c:1660:710d","UDP","176","443  >  41599 Len=114"
"112","20.447294141","2a0d:3344:18fa:4916:f109:b90c:1660:710d","2a00:1450:400c:c06::67","UDP","95","41599  >  443 Len=33"
"113","20.462846621","2a0d:3344:18fa:4916:f109:b90c:1660:710d","2a00:1450:400c:c0b::71","TCP","94","49614  >  443 [SYN] Seq=0 Win=64800 Len=0 MSS=1440 SACK_PERM TSval=509226464 TSecr=0 WS=1024"
"114","20.463014637","2a0d:3344:18fa:4916:f109:b90c:1660:710d","2a00:1450:400c:c0b::71","TCP","94","49618  >  443 [SYN] Seq=0 Win=64800 Len=0 MSS=1440 SACK_PERM TSval=509226464 TSecr=0 WS=1024"
"115","20.463141737","2a0d:3344:18fa:4916:f109:b90c:1660:710d","2a00:1450:400c:c0b::71","TCP","94","49628  >  443 [SYN] Seq=0 Win=64800 Len=0 MSS=1440 SACK_PERM TSval=509226464 TSecr=0 WS=1024"
"116","20.463283850","2a0d:3344:18fa:4916:f109:b90c:1660:710d","2a00:1450:400c:c0b::71","TCP","94","49644  >  443 [SYN] Seq=0 Win=64800 Len=0 MSS=1440 SACK_PERM TSval=509226464 TSecr=0 WS=1024"
"117","20.463396583","2a0d:3344:18fa:4916:f109:b90c:1660:710d","2a00:1450:400c:c0b::71","TCP","94","49654  >  443 [SYN] Seq=0 Win=64800 Len=0 MSS=1440 SACK_PERM TSval=509226464 TSecr=0 WS=1024"
"118","20.468517074","2a00:1450:400c:c0b::71","2a0d:3344:18fa:4916:f109:b90c:1660:710d","QUIC","105","Initial, DCID=86ac02, SCID=e91580fed5667f63, PKN: 1, ACK"
"119","20.469754742","2a00:1450:400c:c0b::71","2a0d:3344:18fa:4916:f109:b90c:1660:710d","QUIC","1294","Initial, DCID=86ac02, SCID=e91580fed5667f63, PKN: 2, ACK, PADDING"
"120","20.470966892","2a00:1450:400c:c0b::71","2a0d:3344:18fa:4916:f109:b90c:1660:710d","QUIC","1294","Initial, DCID=86ac02, SCID=e91580fed5667f63, PKN: 3, CRYPTO, PADDING"
"121","20.470967224","2a00:1450:400c:c0b::71","2a0d:3344:18fa:4916:f109:b90c:1660:710d","QUIC","1294","Initial, DCID=86ac02, SCID=e91580fed5667f63, PKN: 4, CRYPTO, PADDING"
"122","20.472363077","2a00:1450:400c:c0b::71","2a0d:3344:18fa:4916:f109:b90c:1660:710d","QUIC","1294","Handshake, DCID=86ac02, SCID=e91580fed5667f63"
"123","20.472363494","2a00:1450:400c:c0b::71","2a0d:3344:18fa:4916:f109:b90c:1660:710d","QUIC","1294","Handshake, DCID=86ac02, SCID=e91580fed5667f63"
"124","20.472363641","2a00:1450:400c:c0b::71","2a0d:3344:18fa:4916:f109:b90c:1660:710d","QUIC","1294","Handshake, DCID=86ac02, SCID=e91580fed5667f63"
"125","20.472716233","2a0d:3344:18fa:4916:f109:b90c:1660:710d","2a00:1450:400c:c0b::71","QUIC","148","Handshake, DCID=e91580fed5667f63, SCID=86ac02"
"126","20.478962915","AzureWaveTec_40:47:91","Broadcast","ARP","42","Who has 8.8.8.8? Tell 100.96.0.2"
"127","20.497164134","2a00:1450:400c:c06::67","2a0d:3344:18fa:4916:f109:b90c:1660:710d","UDP","91","443  >  41599 Len=29"
"128","20.503857555","2a00:1450:400c:c0b::71","2a0d:3344:18fa:4916:f109:b90c:1660:710d","TCP","94","443  >  49614 [SYN, ACK] Seq=0 Ack=1 Win=65535 Len=0 MSS=1360 SACK_PERM TSval=3687253366 TSecr=509226464 WS=256"
"129","20.503913060","2a0d:3344:18fa:4916:f109:b90c:1660:710d","2a00:1450:400c:c0b::71","TCP","86","49614  >  443 [ACK] Seq=1 Ack=1 Win=65536 Len=0 TSval=509226505 TSecr=3687253366"
"130","20.505395772","2a0d:3344:18fa:4916:f109:b90c:1660:710d","2a00:1450:400c:c0b::71","TLSv1.3","1997","Client Hello (SNI=encrypted-tbn0.gstatic.com)"
"131","20.509706943","2a00:1450:400c:c0b::71","2a0d:3344:18fa:4916:f109:b90c:1660:710d","TCP","94","443  >  49628 [SYN, ACK] Seq=0 Ack=1 Win=65535 Len=0 MSS=1360 SACK_PERM TSval=4065414516 TSecr=509226464 WS=256"
"132","20.509707439","2a00:1450:400c:c0b::71","2a0d:3344:18fa:4916:f109:b90c:1660:710d","TCP","94","443  >  49618 [SYN, ACK] Seq=0 Ack=1 Win=65535 Len=0 MSS=1360 SACK_PERM TSval=3443917021 TSecr=509226464 WS=256"
"133","20.509767718","2a0d:3344:18fa:4916:f109:b90c:1660:710d","2a00:1450:400c:c0b::71","TCP","86","49628  >  443 [ACK] Seq=1 Ack=1 Win=65536 Len=0 TSval=509226510 TSecr=4065414516"
"134","20.509823998","2a0d:3344:18fa:4916:f109:b90c:1660:710d","2a00:1450:400c:c0b::71","TCP","86","49618  >  443 [ACK] Seq=1 Ack=1 Win=65536 Len=0 TSval=509226511 TSecr=3443917021"
"135","20.510473031","2a00:1450:400c:c0b::71","2a0d:3344:18fa:4916:f109:b90c:1660:710d","QUIC","733","Protected Payload (KP0), DCID=86ac02"
"136","20.511305344","2a0d:3344:18fa:4916:f109:b90c:1660:710d","2a00:1450:400c:c0b::71","TLSv1.3","1997","Client Hello (SNI=encrypted-tbn0.gstatic.com)"
"137","20.512637482","2a0d:3344:18fa:4916:f109:b90c:1660:710d","2a00:1450:400c:c0b::71","TLSv1.3","1997","Client Hello (SNI=encrypted-tbn0.gstatic.com)"
"138","20.514282660","2a0d:3344:18fa:4916:f109:b90c:1660:710d","2a00:1450:400c:c0b::71","QUIC","105","Handshake, DCID=e91580fed5667f63, SCID=86ac02"
"139","20.516526513","2a00:1450:400c:c0b::71","2a0d:3344:18fa:4916:f109:b90c:1660:710d","TCP","94","443  >  49654 [SYN, ACK] Seq=0 Ack=1 Win=65535 Len=0 MSS=1360 SACK_PERM TSval=1533550813 TSecr=509226464 WS=256"
"140","20.516572203","2a0d:3344:18fa:4916:f109:b90c:1660:710d","2a00:1450:400c:c0b::71","TCP","86","49654  >  443 [ACK] Seq=1 Ack=1 Win=65536 Len=0 TSval=509226517 TSecr=1533550813"
"141","20.516573120","2a00:1450:400c:c0b::71","2a0d:3344:18fa:4916:f109:b90c:1660:710d","TCP","94","443  >  49644 [SYN, ACK] Seq=0 Ack=1 Win=65535 Len=0 MSS=1360 SACK_PERM TSval=165497049 TSecr=509226464 WS=256"
"142","20.516610435","2a0d:3344:18fa:4916:f109:b90c:1660:710d","2a00:1450:400c:c0b::71","TCP","86","49644  >  443 [ACK] Seq=1 Ack=1 Win=65536 Len=0 TSval=509226517 TSecr=165497049"
"143","20.518148521","2a0d:3344:18fa:4916:f109:b90c:1660:710d","2a00:1450:400c:c0b::71","TLSv1.3","1997","Client Hello (SNI=encrypted-tbn0.gstatic.com)"
"144","20.519541845","2a0d:3344:18fa:4916:f109:b90c:1660:710d","2a00:1450:400c:c0b::71","TLSv1.3","1997","Client Hello (SNI=encrypted-tbn0.gstatic.com)"
"145","20.520724849","2a0d:3344:18fa:4916:f109:b90c:1660:710d","2a00:1450:400c:c0b::71","QUIC","193","Protected Payload (KP0), DCID=e91580fed5667f63"
"146","20.520793282","2a0d:3344:18fa:4916:f109:b90c:1660:710d","2a00:1450:400c:c0b::71","QUIC","129","Protected Payload (KP0), DCID=e91580fed5667f63"
"147","20.522000314","2a0d:3344:18fa:4916:f109:b90c:1660:710d","2a00:1450:400c:c0b::71","QUIC","1294","Protected Payload (KP0), DCID=e91580fed5667f63"
"148","20.522069022","2a0d:3344:18fa:4916:f109:b90c:1660:710d","2a00:1450:400c:c0b::71","QUIC","315","Protected Payload (KP0), DCID=e91580fed5667f63"
"149","20.559704155","2a00:1450:400c:c0b::71","2a0d:3344:18fa:4916:f109:b90c:1660:710d","TCP","98","[TCP Dup ACK 131#1] 443  >  49628 [ACK] Seq=1 Ack=1 Win=270080 Len=0 TSval=4065414569 TSecr=509226510 SLE=1349 SRE=1912"
"150","20.559708090","2a00:1450:400c:c0b::71","2a0d:3344:18fa:4916:f109:b90c:1660:710d","TCP","98","[TCP Dup ACK 128#1] 443  >  49614 [ACK] Seq=1 Ack=1 Win=270080 Len=0 TSval=3687253421 TSecr=509226505 SLE=1349 SRE=1912"
"151","20.559704696","2a00:1450:400c:c0b::71","2a0d:3344:18fa:4916:f109:b90c:1660:710d","TCP","86","443  >  49628 [ACK] Seq=1 Ack=1912 Win=268288 Len=0 TSval=4065414569 TSecr=509226512"
"152","20.559708476","2a00:1450:400c:c0b::71","2a0d:3344:18fa:4916:f109:b90c:1660:710d","TCP","86","443  >  49614 [ACK] Seq=1 Ack=1912 Win=268288 Len=0 TSval=3687253421 TSecr=509226506"
"153","20.559708559","2a00:1450:400c:c0b::71","2a0d:3344:18fa:4916:f109:b90c:1660:710d","TCP","1294","443  >  49614 [ACK] Seq=1 Ack=1912 Win=268288 Len=1208 TSval=3687253422 TSecr=509226506 [TCP PDU reassembled in 155]"
"154","20.559790392","2a0d:3344:18fa:4916:f109:b90c:1660:710d","2a00:1450:400c:c0b::71","TCP","86","49614  >  443 [ACK] Seq=1912 Ack=1209 Win=64512 Len=0 TSval=509226560 TSecr=3687253422"
"155","20.561300976","2a00:1450:400c:c0b::71","2a0d:3344:18fa:4916:f109:b90c:1660:710d","TLSv1.3","1294","Server Hello, Change Cipher Spec"
"156","20.561342611","2a0d:3344:18fa:4916:f109:b90c:1660:710d","2a00:1450:400c:c0b::71","TCP","86","49614  >  443 [ACK] Seq=1912 Ack=2417 Win=63488 Len=0 TSval=509226562 TSecr=3687253422"
"157","20.562331920","2a00:1450:400c:c0b::71","2a0d:3344:18fa:4916:f109:b90c:1660:710d","TLSv1.3","2502","Server Hello, Change Cipher Spec"
"158","20.562332432","2a00:1450:400c:c0b::71","2a0d:3344:18fa:4916:f109:b90c:1660:710d","TCP","2502","443  >  49628 [PSH, ACK] Seq=2417 Ack=1912 Win=268288 Len=2416 TSval=4065414570 TSecr=509226512 [TCP PDU reassembled in 159]"
"159","20.562332582","2a00:1450:400c:c0b::71","2a0d:3344:18fa:4916:f109:b90c:1660:710d","TLSv1.3","476","Application Data"
"160","20.562350489","2a00:1450:400c:c0b::71","2a0d:3344:18fa:4916:f109:b90c:1660:710d","TCP","2502","443  >  49614 [PSH, ACK] Seq=2417 Ack=1912 Win=268288 Len=2416 TSval=3687253422 TSecr=509226506 [TCP PDU reassembled in 166]"
"161","20.562374939","2a0d:3344:18fa:4916:f109:b90c:1660:710d","2a00:1450:400c:c0b::71","TCP","86","49628  >  443 [ACK] Seq=1912 Ack=2417 Win=63488 Len=0 TSval=509226563 TSecr=4065414570"
"162","20.562395194","2a0d:3344:18fa:4916:f109:b90c:1660:710d","2a00:1450:400c:c0b::71","TCP","86","49614  >  443 [ACK] Seq=1912 Ack=4833 Win=61440 Len=0 TSval=509226563 TSecr=3687253422"
"163","20.562410847","2a0d:3344:18fa:4916:f109:b90c:1660:710d","2a00:1450:400c:c0b::71","TCP","86","49628  >  443 [ACK] Seq=1912 Ack=4833 Win=61440 Len=0 TSval=509226563 TSecr=4065414570"
"164","20.562425517","2a0d:3344:18fa:4916:f109:b90c:1660:710d","2a00:1450:400c:c0b::71","TCP","86","49628  >  443 [ACK] Seq=1912 Ack=5223 Win=61440 Len=0 TSval=509226563 TSecr=4065414570"
"165","20.564812847","2a00:1450:400c:c0b::71","2a0d:3344:18fa:4916:f109:b90c:1660:710d","TCP","98","[TCP Dup ACK 132#1] 443  >  49618 [ACK] Seq=1 Ack=1 Win=270080 Len=0 TSval=3443917079 TSecr=509226511 SLE=1349 SRE=1912"
"166","20.564813307","2a00:1450:400c:c0b::71","2a0d:3344:18fa:4916:f109:b90c:1660:710d","TLSv1.3","474","Application Data"
"167","20.564813176","2a00:1450:400c:c0b::71","2a0d:3344:18fa:4916:f109:b90c:1660:710d","TCP","86","443  >  49618 [ACK] Seq=1 Ack=1912 Win=268288 Len=0 TSval=3443917079 TSecr=509226513"
"168","20.564813344","2a00:1450:400c:c0b::71","2a0d:3344:18fa:4916:f109:b90c:1660:710d","TCP","1294","443  >  49618 [ACK] Seq=1 Ack=1912 Win=268288 Len=1208 TSval=3443917079 TSecr=509226513 [TCP PDU reassembled in 171]"
"169","20.564852606","2a0d:3344:18fa:4916:f109:b90c:1660:710d","2a00:1450:400c:c0b::71","TCP","86","49614  >  443 [ACK] Seq=1912 Ack=5221 Win=61440 Len=0 TSval=509226566 TSecr=3687253422"
"170","20.564879188","2a0d:3344:18fa:4916:f109:b90c:1660:710d","2a00:1450:400c:c0b::71","TCP","86","49618  >  443 [ACK] Seq=1912 Ack=1209 Win=64512 Len=0 TSval=509226566 TSecr=3443917079"
"171","20.566106056","2a00:1450:400c:c0b::71","2a0d:3344:18fa:4916:f109:b90c:1660:710d","TLSv1.3","1294","Server Hello, Change Cipher Spec"
"172","20.566134085","2a0d:3344:18fa:4916:f109:b90c:1660:710d","2a00:1450:400c:c0b::71","TCP","86","49618  >  443 [ACK] Seq=1912 Ack=2417 Win=63488 Len=0 TSval=509226567 TSecr=3443917079"
"173","20.568209788","2a00:1450:400c:c0b::71","2a0d:3344:18fa:4916:f109:b90c:1660:710d","TCP","2502","443  >  49618 [PSH, ACK] Seq=2417 Ack=1912 Win=268288 Len=2416 TSval=3443917079 TSecr=509226513 [TCP PDU reassembled in 174]"
"174","20.568210183","2a00:1450:400c:c0b::71","2a0d:3344:18fa:4916:f109:b90c:1660:710d","TLSv1.3","474","Application Data"
"175","20.568243002","2a0d:3344:18fa:4916:f109:b90c:1660:710d","2a00:1450:400c:c0b::71","TCP","86","49618  >  443 [ACK] Seq=1912 Ack=4833 Win=61440 Len=0 TSval=509226569 TSecr=3443917079"
"176","20.568267844","2a0d:3344:18fa:4916:f109:b90c:1660:710d","2a00:1450:400c:c0b::71","TCP","86","49618  >  443 [ACK] Seq=1912 Ack=5221 Win=61440 Len=0 TSval=509226569 TSecr=3443917079"
"177","20.573604062","2a00:1450:400c:c0b::71","2a0d:3344:18fa:4916:f109:b90c:1660:710d","TCP","98","[TCP Dup ACK 139#1] 443  >  49654 [ACK] Seq=1 Ack=1 Win=270080 Len=0 TSval=1533550875 TSecr=509226517 SLE=1349 SRE=1912"
"178","20.574258410","2a0d:3344:18fa:4916:f109:b90c:1660:710d","2a00:1450:400c:c0b::71","TLSv1.3","150","Change Cipher Spec, Application Data"
"179","20.575141818","2a0d:3344:18fa:4916:f109:b90c:1660:710d","2a00:1450:400c:c0b::71","TLSv1.3","150","Change Cipher Spec, Application Data"
"180","20.576071751","2a0d:3344:18fa:4916:f109:b90c:1660:710d","2a00:1450:400c:c0b::71","TLSv1.3","178","Application Data"
"181","20.576133422","2a0d:3344:18fa:4916:f109:b90c:1660:710d","2a00:1450:400c:c0b::71","TLSv1.3","195","Application Data"
"182","20.578063325","2a0d:3344:18fa:4916:f109:b90c:1660:710d","2a00:1450:400c:c0b::71","TLSv1.3","150","Change Cipher Spec, Application Data"
"183","20.578628748","2a0d:3344:18fa:4916:f109:b90c:1660:710d","2a00:1450:400c:c0b::71","TLSv1.3","195","Application Data"
"184","20.579870918","2a00:1450:400c:c0b::71","2a0d:3344:18fa:4916:f109:b90c:1660:710d","TCP","86","443  >  49654 [ACK] Seq=1 Ack=1912 Win=268288 Len=0 TSval=1533550876 TSecr=509226519"
"185","20.579874024","2a00:1450:400c:c0b::71","2a0d:3344:18fa:4916:f109:b90c:1660:710d","TCP","86","443  >  49644 [ACK] Seq=1 Ack=1912 Win=268032 Len=0 TSval=165497114 TSecr=509226520"
"186","20.579874478","2a00:1450:400c:c0b::71","2a0d:3344:18fa:4916:f109:b90c:1660:710d","TLSv1.3","2502","Server Hello, Change Cipher Spec"
"187","20.579874558","2a00:1450:400c:c0b::71","2a0d:3344:18fa:4916:f109:b90c:1660:710d","TCP","1294","443  >  49644 [ACK] Seq=2417 Ack=1912 Win=268032 Len=1208 TSval=165497114 TSecr=509226520 [TCP PDU reassembled in 191]"
"188","20.579922683","2a0d:3344:18fa:4916:f109:b90c:1660:710d","2a00:1450:400c:c0b::71","TCP","86","49644  >  443 [ACK] Seq=1912 Ack=2417 Win=63488 Len=0 TSval=509226581 TSecr=165497114"
"189","20.579944961","2a0d:3344:18fa:4916:f109:b90c:1660:710d","2a00:1450:400c:c0b::71","TCP","86","49644  >  443 [ACK] Seq=1912 Ack=3625 Win=62464 Len=0 TSval=509226581 TSecr=165497114"
"190","20.581828376","2a00:1450:400c:c0b::71","2a0d:3344:18fa:4916:f109:b90c:1660:710d","TCP","1294","443  >  49644 [PSH, ACK] Seq=3625 Ack=1912 Win=268032 Len=1208 TSval=165497114 TSecr=509226520 [TCP PDU reassembled in 191]"
"191","20.581828799","2a00:1450:400c:c0b::71","2a0d:3344:18fa:4916:f109:b90c:1660:710d","TLSv1.3","474","Application Data"
"192","20.581846038","2a00:1450:400c:c0b::71","2a0d:3344:18fa:4916:f109:b90c:1660:710d","TLSv1.3","2502","Server Hello, Change Cipher Spec"
"193","20.581846357","2a00:1450:400c:c0b::71","2a0d:3344:18fa:4916:f109:b90c:1660:710d","TCP","2502","443  >  49654 [PSH, ACK] Seq=2417 Ack=1912 Win=268288 Len=2416 TSval=1533550876 TSecr=509226519 [TCP PDU reassembled in 194]"
"194","20.581846492","2a00:1450:400c:c0b::71","2a0d:3344:18fa:4916:f109:b90c:1660:710d","TLSv1.3","475","Application Data"
"195","20.581851561","2a00:1450:400c:c0b::71","2a0d:3344:18fa:4916:f109:b90c:1660:710d","QUIC","680","Protected Payload (KP0), DCID=86ac02"
"196","20.581851970","2a00:1450:400c:c0b::71","2a0d:3344:18fa:4916:f109:b90c:1660:710d","QUIC","186","Protected Payload (KP0), DCID=86ac02"
"197","20.581859930","2a0d:3344:18fa:4916:f109:b90c:1660:710d","2a00:1450:400c:c0b::71","TCP","86","49644  >  443 [ACK] Seq=1912 Ack=4833 Win=61440 Len=0 TSval=509226583 TSecr=165497114"
"198","20.581852162","2a00:1450:400c:c0b::71","2a0d:3344:18fa:4916:f109:b90c:1660:710d","QUIC","88","Protected Payload (KP0), DCID=86ac02"
"199","20.581852251","2a00:1450:400c:c0b::71","2a0d:3344:18fa:4916:f109:b90c:1660:710d","QUIC","96","Protected Payload (KP0), DCID=86ac02"
"200","20.581852330","2a00:1450:400c:c0b::71","2a0d:3344:18fa:4916:f109:b90c:1660:710d","QUIC","1290","Protected Payload (KP0), DCID=86ac02"
"201","20.581852408","2a00:1450:400c:c0b::71","2a0d:3344:18fa:4916:f109:b90c:1660:710d","QUIC","1294","Protected Payload (KP0), DCID=86ac02"
"202","20.581852492","2a00:1450:400c:c0b::71","2a0d:3344:18fa:4916:f109:b90c:1660:710d","QUIC","782","Protected Payload (KP0), DCID=86ac02"
"203","20.581878469","2a0d:3344:18fa:4916:f109:b90c:1660:710d","2a00:1450:400c:c0b::71","TCP","86","49654  >  443 [ACK] Seq=1912 Ack=2417 Win=63488 Len=0 TSval=509226583 TSecr=1533550876"
"204","20.581892391","2a0d:3344:18fa:4916:f109:b90c:1660:710d","2a00:1450:400c:c0b::71","TCP","86","49644  >  443 [ACK] Seq=1912 Ack=5221 Win=61440 Len=0 TSval=509226583 TSecr=165497114"
"205","20.581898960","2a0d:3344:18fa:4916:f109:b90c:1660:710d","2a00:1450:400c:c0b::71","TCP","86","49654  >  443 [ACK] Seq=1912 Ack=4833 Win=61440 Len=0 TSval=509226583 TSecr=1533550876"
"206","20.581908579","2a0d:3344:18fa:4916:f109:b90c:1660:710d","2a00:1450:400c:c0b::71","TCP","86","49654  >  443 [ACK] Seq=1912 Ack=5222 Win=61440 Len=0 TSval=509226583 TSecr=1533550876"
"207","20.583898923","2a0d:3344:18fa:4916:f109:b90c:1660:710d","2a00:1450:400c:c0b::71","QUIC","102","Protected Payload (KP0), DCID=e91580fed5667f63"
"208","20.583980554","2a00:1450:400c:c0b::71","2a0d:3344:18fa:4916:f109:b90c:1660:710d","QUIC","1290","Protected Payload (KP0), DCID=86ac02"
"209","20.583980878","2a00:1450:400c:c0b::71","2a0d:3344:18fa:4916:f109:b90c:1660:710d","QUIC","1026","Protected Payload (KP0), DCID=86ac02"
"210","20.590094888","2a0d:3344:18fa:4916:f109:b90c:1660:710d","2a00:1450:400c:c0b::71","QUIC","100","Protected Payload (KP0), DCID=e91580fed5667f63"
"211","20.596478058","2a0d:3344:18fa:4916:f109:b90c:1660:710d","2a00:1450:400c:c0b::71","TLSv1.3","150","Change Cipher Spec, Application Data"
"212","20.597349122","2a0d:3344:18fa:4916:f109:b90c:1660:710d","2a00:1450:400c:c0b::71","TLSv1.3","150","Change Cipher Spec, Application Data"
"213","20.597924999","2a0d:3344:18fa:4916:f109:b90c:1660:710d","2a00:1450:400c:c0b::71","TLSv1.3","195","Application Data"
"214","20.598512695","2a0d:3344:18fa:4916:f109:b90c:1660:710d","2a00:1450:400c:c0b::71","TLSv1.3","195","Application Data"
"215","20.616726615","2a00:1450:400c:c0b::71","2a0d:3344:18fa:4916:f109:b90c:1660:710d","TLSv1.3","702","Application Data, Application Data"
"216","20.617747901","2a0d:3344:18fa:4916:f109:b90c:1660:710d","2a00:1450:400c:c0b::71","TLSv1.3","117","Application Data"
"217","20.622800704","2a00:1450:400c:c0b::71","2a0d:3344:18fa:4916:f109:b90c:1660:710d","TLSv1.3","702","Application Data, Application Data"
"218","20.623938439","2a0d:3344:18fa:4916:f109:b90c:1660:710d","2a00:1450:400c:c0b::71","TLSv1.3","110","Application Data"
"219","20.623976117","2a0d:3344:18fa:4916:f109:b90c:1660:710d","2a00:1450:400c:c0b::71","TCP","86","49614  >  443 [FIN, ACK] Seq=2109 Ack=5837 Win=61440 Len=0 TSval=509226625 TSecr=3687253484"
"220","20.629189743","2a00:1450:400c:c0b::71","2a0d:3344:18fa:4916:f109:b90c:1660:710d","TLSv1.3","117","Application Data"
"221","20.630582239","2a00:1450:400c:c0b::71","2a0d:3344:18fa:4916:f109:b90c:1660:710d","QUIC","88","Protected Payload (KP0), DCID=86ac02"
"222","20.631488065","2a00:1450:400c:c0b::71","2a0d:3344:18fa:4916:f109:b90c:1660:710d","TLSv1.3","117","Application Data"
"223","20.631527462","2a00:1450:400c:c0b::71","2a0d:3344:18fa:4916:f109:b90c:1660:710d","TLSv1.3","702","Application Data, Application Data"
"224","20.631527857","2a00:1450:400c:c0b::71","2a0d:3344:18fa:4916:f109:b90c:1660:710d","TLSv1.3","117","Application Data"
"225","20.631552452","2a0d:3344:18fa:4916:f109:b90c:1660:710d","2a00:1450:400c:c0b::71","TCP","74","49614  >  443 [RST] Seq=2085 Win=0 Len=0"
"226","20.632601853","2a0d:3344:18fa:4916:f109:b90c:1660:710d","2a00:1450:400c:c0b::71","TCP","86","49618  >  443 [ACK] Seq=2085 Ack=5868 Win=61440 Len=0 TSval=509226633 TSecr=3443917144"
"227","20.632665512","2a0d:3344:18fa:4916:f109:b90c:1660:710d","2a00:1450:400c:c0b::71","TLSv1.3","110","Application Data"
"228","20.632689259","2a0d:3344:18fa:4916:f109:b90c:1660:710d","2a00:1450:400c:c0b::71","TCP","86","49618  >  443 [FIN, ACK] Seq=2109 Ack=5868 Win=61440 Len=0 TSval=509226633 TSecr=3443917144"
"229","20.637011940","2a00:1450:400c:c0b::71","2a0d:3344:18fa:4916:f109:b90c:1660:710d","TLSv1.3","702","Application Data, Application Data"
"230","20.638067400","2a0d:3344:18fa:4916:f109:b90c:1660:710d","2a00:1450:400c:c0b::71","TLSv1.3","110","Application Data"
"231","20.638105132","2a0d:3344:18fa:4916:f109:b90c:1660:710d","2a00:1450:400c:c0b::71","TCP","86","49654  >  443 [FIN, ACK] Seq=2109 Ack=5838 Win=61440 Len=0 TSval=509226639 TSecr=1533550937"
"232","20.641433080","2a00:1450:400c:c0b::71","2a0d:3344:18fa:4916:f109:b90c:1660:710d","TLSv1.3","702","Application Data, Application Data"
"233","20.642602465","2a0d:3344:18fa:4916:f109:b90c:1660:710d","2a00:1450:400c:c0b::71","TLSv1.3","110","Application Data"
"234","20.642644671","2a0d:3344:18fa:4916:f109:b90c:1660:710d","2a00:1450:400c:c0b::71","TCP","86","49644  >  443 [FIN, ACK] Seq=2109 Ack=5837 Win=61440 Len=0 TSval=509226643 TSecr=165497179"
"235","20.643867862","2a00:1450:400c:c0b::71","2a0d:3344:18fa:4916:f109:b90c:1660:710d","TLSv1.3","117","Application Data"
"236","20.643928289","2a0d:3344:18fa:4916:f109:b90c:1660:710d","2a00:1450:400c:c0b::71","TCP","74","49644  >  443 [RST] Seq=2085 Win=0 Len=0"
"237","20.646849927","2a00:1450:400c:c0b::71","2a0d:3344:18fa:4916:f109:b90c:1660:710d","TLSv1.3","117","Application Data"
"238","20.646912070","2a0d:3344:18fa:4916:f109:b90c:1660:710d","2a00:1450:400c:c0b::71","TCP","74","49654  >  443 [RST] Seq=2085 Win=0 Len=0"
"239","20.667078295","2a00:1450:400c:c0b::71","2a0d:3344:18fa:4916:f109:b90c:1660:710d","TCP","86","443  >  49628 [ACK] Seq=5870 Ack=2099 Win=268288 Len=0 TSval=4065414676 TSecr=509226618"
"240","20.667085388","2a00:1450:400c:c0b::71","2a0d:3344:18fa:4916:f109:b90c:1660:710d","TCP","98","[TCP Dup ACK 222#1] 443  >  49614 [ACK] Seq=5868 Ack=2085 Win=268288 Len=0 TSval=3687253529 TSecr=509226577 SLE=2109 SRE=2110"
"241","20.667085782","2a00:1450:400c:c0b::71","2a0d:3344:18fa:4916:f109:b90c:1660:710d","TCP","86","443  >  49614 [ACK] Seq=5868 Ack=2110 Win=268288 Len=0 TSval=3687253529 TSecr=509226625"
"242","20.667119421","2a0d:3344:18fa:4916:f109:b90c:1660:710d","2a00:1450:400c:c0b::71","TCP","74","49614  >  443 [RST] Seq=2085 Win=0 Len=0"
"243","20.667142990","2a0d:3344:18fa:4916:f109:b90c:1660:710d","2a00:1450:400c:c0b::71","TCP","74","49614  >  443 [RST] Seq=2110 Win=0 Len=0"
"244","20.669887012","2a0d:3344:18fa:4916:f109:b90c:1660:710d","2a00:1450:400c:c0b::71","TCP","86","49628  >  443 [ACK] Seq=2099 Ack=5870 Win=61440 Len=0 TSval=509226671 TSecr=4065414639"
"245","20.670861042","2a00:1450:400c:c0b::71","2a0d:3344:18fa:4916:f109:b90c:1660:710d","TCP","86","443  >  49614 [FIN, ACK] Seq=5868 Ack=2110 Win=268288 Len=0 TSval=3687253529 TSecr=509226625"
"246","20.670899031","2a0d:3344:18fa:4916:f109:b90c:1660:710d","2a00:1450:400c:c0b::71","TCP","74","49614  >  443 [RST] Seq=2110 Win=0 Len=0"
"247","20.673818628","2a00:1450:400c:c0b::71","2a0d:3344:18fa:4916:f109:b90c:1660:710d","TCP","98","[TCP Dup ACK 223#1] 443  >  49618 [ACK] Seq=5868 Ack=2085 Win=268288 Len=0 TSval=3443917186 TSecr=509226633 SLE=2109 SRE=2110"
"248","20.676931450","2a00:1450:400c:c0b::71","2a0d:3344:18fa:4916:f109:b90c:1660:710d","TCP","98","[TCP Dup ACK 237#1] 443  >  49654 [ACK] Seq=5869 Ack=2085 Win=268288 Len=0 TSval=1533550977 TSecr=509226599 SLE=2109 SRE=2110"
"249","20.676933883","2a00:1450:400c:c0b::71","2a0d:3344:18fa:4916:f109:b90c:1660:710d","TCP","86","443  >  49618 [ACK] Seq=5868 Ack=2110 Win=268288 Len=0 TSval=3443917190 TSecr=509226633"
"250","20.676934261","2a00:1450:400c:c0b::71","2a0d:3344:18fa:4916:f109:b90c:1660:710d","TCP","86","443  >  49618 [FIN, ACK] Seq=5868 Ack=2110 Win=268288 Len=0 TSval=3443917190 TSecr=509226633"
"251","20.676968355","2a0d:3344:18fa:4916:f109:b90c:1660:710d","2a00:1450:400c:c0b::71","TCP","74","49654  >  443 [RST] Seq=2085 Win=0 Len=0"
"252","20.677003438","2a0d:3344:18fa:4916:f109:b90c:1660:710d","2a00:1450:400c:c0b::71","TCP","86","49618  >  443 [ACK] Seq=2110 Ack=5869 Win=61440 Len=0 TSval=509226678 TSecr=3443917190"
"253","20.682526634","2a00:1450:400c:c0b::71","2a0d:3344:18fa:4916:f109:b90c:1660:710d","TCP","86","443  >  49654 [ACK] Seq=5869 Ack=2110 Win=268288 Len=0 TSval=1533550982 TSecr=509226639"
"254","20.682527062","2a00:1450:400c:c0b::71","2a0d:3344:18fa:4916:f109:b90c:1660:710d","TCP","86","443  >  49654 [FIN, ACK] Seq=5869 Ack=2110 Win=268288 Len=0 TSval=1533550982 TSecr=509226639"
"255","20.682563263","2a0d:3344:18fa:4916:f109:b90c:1660:710d","2a00:1450:400c:c0b::71","TCP","74","49654  >  443 [RST] Seq=2110 Win=0 Len=0"
"256","20.682585894","2a0d:3344:18fa:4916:f109:b90c:1660:710d","2a00:1450:400c:c0b::71","TCP","74","49654  >  443 [RST] Seq=2110 Win=0 Len=0"
"257","20.684983244","2a00:1450:400c:c0b::71","2a0d:3344:18fa:4916:f109:b90c:1660:710d","TCP","98","[TCP Dup ACK 235#1] 443  >  49644 [ACK] Seq=5868 Ack=2085 Win=268032 Len=0 TSval=165497224 TSecr=509226599 SLE=2109 SRE=2110"
"258","20.685007131","2a0d:3344:18fa:4916:f109:b90c:1660:710d","2a00:1450:400c:c0b::71","TCP","74","49644  >  443 [RST] Seq=2085 Win=0 Len=0"
"259","20.690711753","2a00:1450:400c:c0b::71","2a0d:3344:18fa:4916:f109:b90c:1660:710d","TCP","86","443  >  49644 [ACK] Seq=5868 Ack=2110 Win=268032 Len=0 TSval=165497229 TSecr=509226643"
"260","20.690712203","2a00:1450:400c:c0b::71","2a0d:3344:18fa:4916:f109:b90c:1660:710d","TCP","86","443  >  49644 [FIN, ACK] Seq=5868 Ack=2110 Win=268032 Len=0 TSval=165497229 TSecr=509226643"
"261","20.690748867","2a0d:3344:18fa:4916:f109:b90c:1660:710d","2a00:1450:400c:c0b::71","TCP","74","49644  >  443 [RST] Seq=2110 Win=0 Len=0"
"262","20.690788025","2a0d:3344:18fa:4916:f109:b90c:1660:710d","2a00:1450:400c:c0b::71","TCP","74","49644  >  443 [RST] Seq=2110 Win=0 Len=0"
"263","21.410197465","2a0d:3344:18fa:4916:f109:b90c:1660:710d","2a00:1450:400c:c06::67","UDP","1294","41599  >  443 Len=1232"
"264","21.410267887","2a0d:3344:18fa:4916:f109:b90c:1660:710d","2a00:1450:400c:c06::67","UDP","1205","41599  >  443 Len=1143"
"265","21.460920312","2a00:1450:400c:c06::67","2a0d:3344:18fa:4916:f109:b90c:1660:710d","UDP","92","443  >  41599 Len=30"
"266","21.462856761","2a00:1450:400c:c06::67","2a0d:3344:18fa:4916:f109:b90c:1660:710d","UDP","95","443  >  41599 Len=33"
"267","21.463106973","2a0d:3344:18fa:4916:f109:b90c:1660:710d","2a00:1450:400c:c06::67","UDP","95","41599  >  443 Len=33"
